"the total liability of the company and the other company parties, for any claim arising out of or relating to these terms or our services, regardless of the form of the action, is limited to the greater of any amount paid, if any, by you to access or use our services or $100 usd"
failure to enforce such rules in some instances does not constitute a waiver of our right to enforce such rules in other instances.
b) lbry enables publishers to offer content for sale to other users by setting contract terms within the metadata of the content.
"our services are provided as is and as available without warranties of any kind, either express or implied, including, but not limited to, implied warranties of merchantability, fitness for a particular purpose, title, and non-infringement."
copyright complaints we have a policy of limiting access to our services and terminating the accounts of users who infringe the intellectual property rights of others.
"in some cases, we may provide additional notice to you, such as via our services or to an email address associated with your account."
"termination or suspension notwithstanding anything contained in these terms, we reserve the right, without notice and in our sole discretion, to terminate this agreement or suspend your right to access the services."
"by using the software or service, you represent and warrant that you are not located in any such country or on any such list."
your continued use of the services following our provision of any such notice will confirm your acceptance of the revised terms.
you agree to comply with all applicable export and import laws and regulations.
eligibility you must be at least 13 years of age to access or use our services.
"in particular, but without limitation, the software may not be exported or re-exported (a) into any u.s"
"feedback any questions, comments, suggestions, ideas, original or creative materials or other information you submit about the company or our products or services (collectively, feedback ), is non-confidential and will become the sole property of the company."
"severability if any term, clause or provision of these terms is held invalid or unenforceable, then that term, clause or provision will be severable from these terms and will not affect the validity or enforceability of any remaining part of that term, clause or provision, or any other term, clause or provision of these terms."
embargoed countries or (b) to anyone on the u.s
the company does not have the power or responsibility to provide any refunds.
"we will own exclusive rights, including, without limitation, all intellectual property rights, in and to feedback and will be entitled to the unrestricted use and dissemination of feedback for any purpose, commercial or otherwise, without acknowledgment or compensation to you"
amendment we reserve the right to change these terms from time to time upon notice to you.
(b) your content or any name that you have reserved.
"limitation of liability the company and the other company parties will not be liable to you under any theory of liability whether based in contract, tort, negligence, strict liability, warranty, or otherwise for any indirect, consequential, exemplary, incidental, special or punitive damages or lost profits, even if the company or the other company parties have been advised of the possibility of such damages"
"no class arbitrations, class actions or representative actions any dispute arising out of or related to these terms or the services is personal to you and the company and will be resolved solely through individual arbitration and will not be brought as a class arbitration, class action or any other type of representative proceeding."
"if you are under 18 years of age (or the age of legal majority where you live), you may only access or use our services under the supervision of a parent or legal guardian who agrees to be bound by these terms."
"or (d) your violation, misappropriation or infringement of any rights of another (including intellectual property rights or privacy rights)."
"instead, you and the company will arbitrate disputes through binding arbitration (which is the referral of a dispute to one or more persons charged with reviewing the dispute and making a final and binding determination to resolve it instead of having the dispute decided by a judge or jury in court)."
"if we make changes to these terms, we will provide notice of such changes by posting the revised terms to the services and updating the last updated date at the top of these terms."
"survival the following sections will survive the expiration or termination of these terms: all defined terms and sections 12 - 18, 21 and 22"
you may terminate this agreement without notice by discontinuing use of the services.
"d) stalk, intimidate, threaten, or otherwise harass or cause discomfort to other users."
"any dispute between the parties arising out of or relating to these terms that is not subject to arbitration or cannot be heard in small claims court will be resolved in the state or federal courts of the state of delaware and the united states, respectively, sitting in new castle county, delaware."
department of commerce denied person s list or entity list.
disclaimers your use of our services is at your sole risk.
"company, in its sole discretion, may from time to time impose limits on the ability to sell content via the services."
treasury department s list of specially designated nationals or the u.s
"in addition, the company does not represent or warrant that our services are accurate, complete, reliable, current or error-free."
(c) your violation of these terms.
