text,highlighted
"For web and mobile based data transfers, data is sent over an encrypted channel with server side aes 256-bit encryption. if you choose the default encryption option, the system chooses a key for encrypting your data.",1
1.,0
"Notices any notice under these terms given by idrive inc. to you will be deemed to be properly given if sent (i) by email to your email address as set forth in the registration information, (ii) by a startup screen that starts before your next use of the services, (iii) by written communication mailed by first class u.s. mail to your address on record in the registration information, or (iv) by a display about the changed information in the terms on our website.",0
"Except as otherwise expressly provided for in these terms of use, any price changes or changes to your subscription plan will take effect following notice to you. please note that we may automatically receive updated credit card information from our merchants from time to time in cases where your account is issued a new card number or your credit card expires.",0
Evs facilitates developers to produce third party applications that utilize idrive for backup purposes.,0
"Other changes may be posted to our blog or terms page, so please check those pages regularly.",0
"You agree that by using third party applications to access your account, you are doing so at your own risk.",0
Please reference the windows notes and mac notes for previous account versions.,0
"On successful cancellation of an account by you or by us, due to various reasons including non-payment for the services, your data will be removed from our storage servers.",0
It is important that you maintain a correct working email address and update it if necessary to be able to receive our communications.,0
"You are liable for returning damaged bmr appliance, including damages caused during shipping due to poor packaging.",0
"Your account you agree to provide us with accurate and complete information when you create an idrive account (your ""account"").",0
"Partner management disclaimer: under our 'partner management' feature, we provide our resellers direct access to the bmr server of their customers through the centralized web console with automatic login.",0
It is also important that you monitor your local and cloud backups periodically to make sure that the backups are taking place successfully.,0
"However, no password-protected system of data storage and retrieval can be made entirely impenetrable.",0
Release dates are posted on the product download pages.,0
Class action clause you agree that class actions are not allowed and all disputes with idrive must be resolved on an individual basis .,0
This allows for easy central administration of multiple accounts that can be based on administrator set quota levels or different plans according to user needs.,0
(ii) if we are required to do so by law.,1
"Termination we may, at our option and in addition to other remedies, immediately and without notice terminate these terms at any time or suspend your access to the services: (i) if you breach any provision of these terms.",0
"However, idrive disclaims all responsibility and liability arising out of the use of third party applications, and we do not provide any warranties, express or implied, regarding the functionality, use, or performance of any third party applications.",0
"Idrive for wordpress, idrive lite, idrive contacts, and idrive photo backup the idrive for wordpress plug-in, idrive lite, idrive contacts, and idrive photo backup accounts are based on different technologies and are not inter-operable with standard idrive accounts.",0
"Please note on cancellation, refunds are issued if account is canceled within thirty (30) days of its creation date.",0
We are not responsible for any business interruptions that may be caused due to this process).,0
"Multiple computers, additional/sub-accounts and bulk resellers idrive offers an additional/sub-accounts feature for clear separation of authentication and encryption key (if used).",0
(c) will not use the services to sell and/or distribute digital content to others.,0
These terms constitute the entire and exclusive agreement between you and idrive inc. with respect to the subject matter hereof and supersedes any and all prior and contemporaneous understandings and agreements. 1-818-485-4333 business days: 6:00 am to 6:00 pm pst my idrive sign up features download pricing plans security educational offer blog idrive vs competition nas backup synology backup qnap backup netgear backup asustor backup products mobile backup linux backup idrive bmr disk clone server cloud backup sql server exchange server vmware hyper-v sharepoint server oracle server office 365 mailbox features unlimited device online backup small businesses manage computers via web snapshots true archiving idrive backtrack services resellers idrive express business compliance resources support faqs video tutorials corporate idrive ventures press releases reviews legal â© idrive inc.,0
You will commence any claim or cause of action arising under or otherwise occurring by reason of these terms within one (1) year after the claim or cause of action arises or such claim or cause of action is forever barred.,0
Our failure to insist upon or enforce strict performance of any provision or right of these terms will not be construed as a waiver of any provision or right.,0
"In that case, ""you"" and ""your"" will refer to that organization. it is important to note that the functionality of the service is time-dependent and these terms represent the functionality as of now.",0
Recovery of any lost data is not guaranteed.,0
"Instead, our relationship is that of independent contractors.",0
Security account passwords you are solely responsible for any consequences arising out of your failure to maintain the confidentiality of your account password and/or encryption password.,0
"All claims arising out of or relating to these terms or the services or software must be litigated exclusively in the federal or state courts of los angeles county, california, and both parties consent to venue and personal jurisdiction there.",0
"Idrive reserves the right to be the primary support for sub-accounts under certain cases. a main account holder/bulk reseller has the authority to cancel the additional/sub-accounts as well as the main account, for any reason.",0
Please note that all of your data will be deleted from your idrive cloud account on cancellation.,0
"If for any reason any provision of the terms is held to be invalid or unenforceable under applicable law to any extent, then (i) such provision will be interpreted, construed or reformed to the extent reasonably required to render the same valid, enforceable and consistent with the original intent underlying such provision and (ii) such invalidity or unenforceability will not affect any other provision of the terms.",0
"For private key accounts: should you choose to use a user defined private key for encrypting your data, idrive personnel will not have access to this key and it will not be stored on the idrive servers .",0
"While it is not necessary, we encourage users to upgrade to one of the higher storage plans if the usage exceeds the quota limit for their chosen plan, to avoid overuse charges.",0
These terms create no third party beneficiary rights.,0
"While it is not necessary, we encourage users to upgrade to one of the higher storage plans if their usage exceeds the quota limit for their chosen plan to avoid the overuse charges.",0
3.,0
"If youâd like to close your account prior to the end of your annual subscription term, please contact our support team. warranty for the idrive bmr appliance will be provided as long as the subscription is active.",0
This feature is offered for no additional fee.,0
"This decision may be made based on raid level, distributed nature of the file system where user account resides and other criteria.",0
Businesses must choose team or business plans.,0
"Billing automatic renewal - paid plans in exchange for use of the services, you authorize a recurring monthly or annual charge to your credit card.",0
"Idrive is not responsible for loss of data arising as a result of such cases. when signing in to your account via the desktop client, you will need to enter your private key, but it is only stored on the client and is never sent to the idrive servers.",0
We also recommend using private encryption key for additional security.,0
"To ensure proper delivery of email communications, please whitelist '@idrive.com' domain in your email spam filter. any notice under these terms provided by you will be deemed to be properly given if received by customer service at support@idrive.com, except those that are related to cancellation or termination of your account.",0
Modifications to this agreement we may change these terms from time to time and the most current version will always be posted on our website located at&nbsp;http://www.idrive.com.,0
'cancel at the end of your annual term' is available online by disabling auto-renewal option.,0
7.,0
"Idrive bmr appliance terms of service idrive bmr appliance operates in conjunction with idrive's online backup service. idrive bmr solution is provided via subscription service, which includes the idrive bmr appliance as well as the cloud backup solution.",0
"If there is no redundant backup of primary production data, we may not be able to recover data in the event of failure and we may need to initiate a fresh backup of user data. the general guideline to users is that we strongly recommend a local backup of user data on premise.",0
"Our policy regarding the privacy and use of the registration information is set forth in our privacy policy, which may be modified and amended by us from time to time.",0
"Idrive for wordpress is a wordpress plug-in that uses snapshots technology to retrieve earlier copies of data, which is limited to last ten (10) days snapshots (may change without notice).",0
Idrive serves main account holder/bulk reseller as a secondary support provider.,0
"Idrive can rely on the name and address you provide to idrive as being the place of supply for sales tax, income tax, and vat purposes.",0
"Please note on cancellation, refunds are issued if account is canceled within fifteen (15) days of its creation date.",0
Your continued use of the services after such revisions become effective will constitute your acceptance of such changed terms and conditions.,0
Sending an email to support@idrive.com for cancellation is not considered as a cancellation notice for security reasons.,0
You agree to return the appliance on cancellation of subscription.,0
We may delay the cancellation related to non-payment for the services and provide a grace period of up to sixty (60) days from the due date to allow for the customer to arrange for payments.,0
(b) terminate these terms.,0
"Limitations of liability in no event shall idrive inc. or its affiliates, agents, advertisers or suppliers have any obligation or liability to you for (i) the cost of procurement of substitute services or data or (ii) any direct, indirect, incidental, special, punitive, exemplary or consequential damages (including, without limitation, any loss of data, revenue or profits or business interruption) or other pecuniary loss arising out of your use or inability to use your account or the service or your loss of data or files stored therein regardless of legal theory, whether or not idrive inc. has been warned of the possibility of such damages, and even if a remedy fails of its essential purpose.",0
13.,0
"While your data is still encrypted, idrive personnel may still be able to decrypt your data using your registration information if such a situation should ever arise.",1
The recurring charge will be at the published standard plan that is chosen at the time of sign-up or to a customized quote provided for your specific use.,0
"When you provide your private key while signing in to your account using the web application, the key is sent to our servers for the duration of that session only and the key always remains fully encrypted throughout transmission.",0
"Taxes youâre responsible for all applicable taxes, and weâll charge tax when required to do so.",0
"If the account is cancelled for any reason, user data and its backups will be removed from our storage servers.",0
"In case of non-action by the user, the account may be cancelled.",0
This is to ensure faster and more efficient virtualization and recovery.,0
"Idrive requires periodic review, at least on a weekly basis to verify the execution of backups because backups may fail for any number of reasons including but not limited to, internet connectivity issues, authentication issues, firewall, blocks by anti-virus programs, system configuration changes to the computer, etc.",0
"Ensure weekly inspection of your bmr appliances by logging into the admin console, to check the backup and hard drive status of the device. overuse: certain paid accounts are allowed to use storage space beyond the chosen plan's quota limit.",0
Upgrades may involve additional charges.,0
No pro-rated refunds will be issued for the time remaining in your annual subscription if you choose to disable auto-renewal.,0
"Accordingly, you hereby acknowledge that it may be possible for an unauthorized third party to access, view, copy, modify and distribute the data and files you store in your account.",0
"An inactive account is an account where no sign in has occurred either automatically or manually for a specified period of time. personal, team, and business accounts personal accounts are for personal and home use only.",0
"If the main account holder and/or bulk reseller retains the usernames and passwords of the additional/sub-accounts, he/she will have read/write access to the additional/sub-accounts including access to profile information, backup sets, backup schedules, and even data if there is no private encryption key set. primary support responsibility related to additional/sub-accounts resides with the main account holder/bulk reseller.",0
Please contact bmr customer support service to disable direct access to the bmr server. 12.,0
You should also periodically update the backup client to the most recent version.,0
"You may not assign any of your rights in these terms, and any such attempt is void, but we may assign our rights to any of our affiliates or subsidiaries, or to any successor in interest of any business associated with the services.",0
Use of ip addresses we may collect ip addresses for the purposes of system administration and/or to audit the use of our site.,0
"If you believe there has been unauthorized access to your account, you must notify privacy@idrive.com immediately.",0
"As with many services like broadband providers, there may be substantial pricing, storage and functionality differences between personal, team, and business accounts. 5.",0
"If youâd like to close your account prior to the end of your annual subscription term, please contact our support team. overuse - paid plans certain paid accounts are allowed to use storage space beyond the chosen plan's quota limit.",0
"Upon any termination of these terms, we will remove stored in idrive backup and/or idrive sync data files from main storage and archives immediately.",0
"Personal, team, and business idrive accounts are not authorized or licensed for bulk resale.",0
"We can and will use ip addresses to identify a user when we feel it is necessary to enforce compliance with our policies, terms, or to protect our service, site, customers, or others.",1
"For maximum privacy and security, we recommend that you choose the user defined private key option to protect the data in your account. encryption system idrive supports 256-bit aes data encryption before transmission from your computer using either (i) a default key or (ii) an optional user defined private key created by you.",0
"Note for bmr accounts: idrive bmr secures data at rest, both local and on the cloud, with aes 256 ccm encryption. however, for legacy bmr users (bmr 6.0.0 and lower), there is no encryption at rest by default for bmr cloud accounts.",0
19.,0
"Sign up login home sign up features unlimited device online backup manage computers via web snapshots true archiving idrive backtrack more features products mobile backup linux backup idrive bmr disk clone server backup server cloud backup sql server exchange server vmware hyper-v sharepoint server oracle server office 365 mailbox nas backup synology backup qnap backup netgear backup asustor backup turbotax backup services resellers idrive express business compliance pricing download small business enterprise idrive bmr faqs tutorials support resellers small business enterprise idrive bmr support faqs tutorials blog more featureswhen you need more than just backup. multiple device backup server cloud backup online file sync idrive express linux backup mobile backup manage computers true archiving menu sign up english spanish french german online backup for pc, mac and iphone | idrive features of idrive online backup download get apps for pc, mac, linux and mobiles pricing storage options made for all legal information menu terms of service terms and conditions privacy policy gnu general public license (gpl) service level agreement (sla) dmca policy acceptable use policy gdpr compliance statement terms of service last updated:&nbsp;04/24/2015 please carefully read the following terms of service before registering for and using the idrive service.",0
"If you do not agree to the new terms, please stop using the services.",0
17.,0
"After 15 days, pro-rated refunds are issued on a case-by-case basis subject to eligibility.",0
We can enable an optional file system encryption on request.,0
You may not bring any claim against idrive as a class member.,0
"Should you object to any of these terms or any subsequent modifications thereto or become dissatisfied with the services in any way, your only recourse is to immediately: (a) discontinue use of the services.",0
You must cancel your account before it renews each year in order to avoid a charge for the next year's fees to your credit card.,0
"It is always recommended that you make use of the two tier backup solution, with one tier of backup with the bmr appliance, and second tier with the idrive cloud for best data protection.",0
Refunds you must cancel your account before it renews each month or year in order to avoid a charge for the next month's or year's fees to your credit card.,0
"Fair use notice: any copyrighted materials used in this website, like third-party logos (windows, mac, linux 'tux' etc) are the property of their respective owners/companies. 18.",0
"Accordingly, your account and the service is provided to you on an ""as is"" and ""as available"" basis, at your own risk.",0
The servers on which the bmr cloud data exists have sufficient protection from intrusion and attacks.,0
Idrive now has local backup capability with encryption and private key support and we strongly encourage our users to make full use of this.,0
Or (iv) for any other reason with thirty (30) days prior written notice to you (or sooner if you are flagrantly violating these terms or are a threat to users or the services).,1
6.,0
(iii) if we cease to offer any services covered by these terms.,1
"For absolute privacy, we recommend use of the private encryption key which allows use of a key known only to the user in addition to the basic account credentials.",0
"We will not issue any pro-rated refunds for the remaining period of a month when an account with a monthly subscription plan (""current plan"") is downgraded to a smaller plan (""new plan"") (a plan that costs less per month than the current plan) during the middle of a month.",0
"Depending on the configuration, exceeding the quota limits may result in a hard stop on the backups. free accounts we reserve the right to terminate free accounts at any time, with or without notice.",0
"Based on your privacy and security needs, you need to make an appropriate encryption key choice.",1
It is critical that users do not remove the data on their local computer that they backed up to idrive and keep only one copy of data on idrive.,0
"Data is transferred from the local bmr device to the cloud, encrypted with 128-bit ssl.",0
"If you are registering for the service on behalf of an organization, you are agreeing to these terms for that organization and promising that you have the authority to bind that organization to these terms.",0
Any data backed up using the services can only be retrieved using your key and if you forget or misplace this key then your data may not be retrievable.,0
"Please carefully read the gpl as well as our service level agreement and privacy policy, which are incorporated into these terms.",0
Discrepancies your right to raise a billing discrepancy and any associated recovery is waived unless reported to us by calling our customer support line or emailing us at support@idrive.com within sixty (60) calendar days after such discrepancy is charged to your credit card.,0
We may also access the account and data for support related activities.,1
"If the main account is canceled, all additional accounts and/or sub-accounts will, by default, be canceled as well.",0
"Some services, such as user logs and registration emails, may also display ip addresses.",1
"By registering for an idrive account you or the entity you represent (""you"" and ""your"") agree to be bound by these terms of service (the ""terms""), which govern your access to and use of the idrive service (the ""service"") offered by idrive inc. (""we"", ""us"" or ""our"").",0
"The main account holder/bulk reseller may be responsible for actions arising from additional account holders and/or sub-account holders, and is responsible for ensuring all such accounts adhere to these terms. upon setup, the main account holder/bulk reseller will set up a username and password for the additional/sub-account.",0
"Paragraphs 12, 13, 16, 17, 18 and 19 of these terms (and any other provision that can be reasonably construed to survive termination) will survive termination of these terms.",0
"Conditions of use by using the services, you agree that you: (a) are solely responsible for obtaining sufficient rights to the content of all data and files stored by you on idrive servers.",0
4.,0
Please note that all of your data will be deleted when your account is terminated.,1
Idrive bmr appliance is provided to you as long as the subscription is active.,0
"We will be entitled, at our expense, to participate in the defense and settlement of the claim or action with counsel of our own choosing.",0
You will notify us of any unauthorized use or breach in security of your account immediately after you learn of such unauthorized access or use .,0
"Registration information / privacy you agree to promptly notify us of any change in the information you provided during your registration for the services (including, without limitation, any change in your mailing address, telephone numbers or email address).",0
"In case the user does not have access to the email address, other means of verification may be used including billing/credit card information to verify identity.",0
"(b) that access to your account or the service will be timely, error-free, uninterrupted, virus-free or secure.",0
These metadata and derivatives are necessary for faster display and search.,1
It is possible that earlier versions of the service do not support all the functionalities as described below.,0
"We may request a fresh backup from users via the idrive express service to expedite in cases where there is a suspected loss or corruption of data due to hardware or software failures, or just via the online backup process.",0
"Some applications of the service may implement open source code released under the gnu general public license (""gpl"").",0
Miscellaneous these terms and the use of the services and software will be governed by california law except for its conflicts of laws principles.,0
"However the rate applicable to the new plan will automatically be charged starting the first of the subsequent month. for yearly accounts created after november 23, 2011, you have the option of disabling auto-renewal and your account will terminate at the end of your annual term.",0
"Without limiting the foregoing, if a free account is inactive for ninety (90) days, then we reserve the right to terminate the free account without providing additional notice.",0
Certain metadata related to files including file thumb derivatives may not be encrypted.,1
Third party applications idrive implements the services using our evs technology.,0
"In the event of hardware or software errors at the idrive end and subsequent re-backups either via online or via express, this may still leave users without some of their data if the data is removed from their desktop that they may eventually need for restore.",0
And (c) notify us of such termination as described below in paragraph 17.,0
This encryption process encrypts the data contained within the file and not the file-name itself.,1
"Versions do not count against your quota limit, however if the amount of space required to maintain previous versions exceeds two times the actual storage being used, we reserve the right to limit the number of versions retained for your account.",0
It is the additional/sub-account user's responsibility to change the password on the account.,0
The provisions of the u.n. convention on contracts for the international sale of goods and any successor treaties will not apply.,0
