text,highlighted
"And (d) will not access or attempt to access the services by any means other than those provided on the idrive website or by an authorized third party. if there is suspicion that an account is being used for storage and distribution of any illegal material such as copyrighted content, we reserve the right to examine the content of the online storage and backup account.",0
Cancellation &amp.,0
An email will be sent to the additional/sub-account user with this sign in information.,0
"We reserve the right to refuse, remove or disable access to any data or files stored on our servers with immediate effect that we determine may be illegal, may violate these terms, may violate the rights of any third party or otherwise may be reasonably objectionable.",1
Idrive inc. and you are not legal partners or agents.,0
"We advise you to audit your logs for the desktop application completely including individual entries for files and total count periodically to ensure that the backups are taking place successfully and in case of errors, take corrective action.",0
We advise frequent changes to the account password for better security.,0
"(b) will not violate, or encourage or facilitate the violation of, any aspect of our acceptable use policy.",0
"(the services are not for storing and disseminating large amounts of data to large number of recipients or for dissemination of digital content for commercial purposes, and we may use procedures, which may vary from time to time, to detect unacceptable levels of usage and may immediately disable offending accounts based on detected misuse.",0
You may terminate these terms at your convenience by delivering at least thirty (30) days prior written notice to us.,1
Users will need an active idrive subscription to avail the idrive express service.,0
"In order to verify that the information you enter is correct, a derivative of that key is generated and matched, allowing you to access your account.",0
"Online or cloud backup should always be a complementary solution to local backup and not be the only solution. due to relatively large sizes of storage devices, some of the recovery and repair efforts in the event of a failure may take many days or weeks, and is not guaranteed.",0
We strongly advise that you only use trusted third party applications and review the terms provided with third party applications beforehand.,0
11.,0
"In case of cancellation of main account holder/bulk reseller due to non-payment, idrive reserves the rights to keep the additional/sub-accounts active for some time and contact them to sign up directly with idrive services. idrive also supports the ability to backup an unlimited number of computers, tablets, and/or mobile devices to a single account.",0
"This feature is designed to allow the partners to monitor the bmr device, as well as the backup status and remotely manage the bmr device for their customers.",0
You may not settle any claims that limit our rights without our prior written consent. 16.,0
8.,0
(d) that the data on your desktop or server will not be lost or damaged.,1
2.,0
"Redundant backups of your data based on the protection level of primary production devices, we may or may not keep redundant backups of the primary production data.",0
You agree to pay the subscription fees on time at the start of each subscription period for the whole solution.,0
Or (e) that defects in the service will be corrected .,0
"Idrive inc., on behalf of itself and its distributors, advertisers and suppliers, disclaims all warranties and conditions, express or implied, arising by law or otherwise, with respect to your account and the service (including, without limitation, any implied warranties of merchantability, fitness for a particular purpose and non-infringement).",0
"Alternatively, an archive cleanup operation can be performed to potentially bring the account under the quota limit.",0
"However, for usage beyond the quota limit, there maybe an overuse charge at the rate of $0.25/gb/month for personal plan and $0.50/gb/month for team and business plans.",0
The user defined private encryption key option and certain items discussed in http://www.idrive.com/online-backup-compliance are also not applicable to these products and are only applicable to windows and mac idrive accounts.,0
You also agree that the enrollment for the next service period is automatic and paid in advance. we reserve the right to change our subscription plans or adjust pricing for our service or any components thereof in any manner and at any time as we may determine in our sole and absolute discretion.,0
"In order to backup multiple computers, your authentication information must be replicated on each computer you wish to backup, including the private encryption key (if used).",0
"We need a credit card on file while the account is active. if we are unable to execute any applicable charges due to credit card denial or for any other reason, you will be notified via email.",0
"Disclaimer of warranties the transmission, storage, viewing and retrieval of data and files through the world wide web is subject to a variety of conditions that make such transmission, storage, viewing and retrieval potentially unreliable.",0
"Upon cancellation of your account, you must return the bmr appliance to idrive.",0
We also provide options to configure cloud retention policy and delete data from the cloud.,0
"This includes class arbitrations, class actions, private attorney general actions, and consolidation with other arbitrations.",0
Warranty is limited to providing replacement parts or replacement of the entire appliance with a new one.,0
It is very important that you store your user defined private key in a safe place and maintain this key in printed form for reference.,0
We endeavor to restrict access to the data and files you store or retrieve from your account to persons you have authorized to access your account.,0
Failure to return the appliance will result in your account being charged for the cost of the appliance.,0
"However, we still advise you update your card manually from your account screen when changes to your account information occur.",0
"For special cases where youâd like to close your account prior to the end of your annual subscription term, please contact our support team.",0
"We normally do not review, inspect, edit or monitor any content, data or files stored by you or any other user of the service.",0
"If we think a revision is material we will notify you (e.g., via email).",1
"The registration information (including your selected username and password) provided by you during your registration for the service, together with any and all updates provided by you from time to time under this paragraph, is referred to in these terms as the ""registration information.""",0
"If you have used the local backup feature, you will not be able to access data from your external drive as well.",0
"We allow you to retain and restore thirty (30) previous versions of all files backed up to your account (for accounts created prior to 11-07-2018, 10 previous versions are stored).",0
"After 30 days, pro-rated refunds are issued on a case-by-case basis subject to eligibility.",0
We highly recommend that a maximum count of five computers per sub-account (while there is no enforced limit) must be maintained for best performance and reliability.,0
This is designed to allow uninterrupted backups in case the usage exceeds the quota limit.,0
We may delay account cancellation related to non-payment for the services and provide a grace period of up to sixty (60) days from the due date to allow for the customer to arrange payment.,0
The automated forget password option works on the assumption that only the account holder has access to the email address on record.,0
You understand that you will not hold idrive inc. accountable for any data loss due to the use of idrive bmr solution.,0
You acknowledge that any material or data you retrieve through the use of the service is done at your choice and risk and that you will be solely responsible for any damage to your computer system or loss of data that results from the retrieval of such material or data.,1
We require all developers to agree to our developer terms and to adhere to our privacy policy to protect the safety of our users.,0
"We are not liable for any loss or damage arising from any access to, content in, or sharing and use of your account.",1
"Again, we strongly recommend not to use idrive as the only source of your data backup, a local copy is strongly recommended.",0
"However, for usage beyond the quota limit, there may be an overuse charge at the rate of $120/tb/month for all bmr plans.",0
"If idrive determines that a personal, team, or business account is being used for resale, idrive reserves the right to immediately suspend that account and will require the account to be reclassified as a reseller account under reseller pricing and terms for the entire period of time personal account space was being resold, otherwise the offending account will be forced to forfeit the account without refund. 9.",0
Idrive inc. makes no representation or warranty: (a) that your account or the service will meet your needs.,1
20.,0
"Regardless of whether any such dispute, controversy or claim concerns any other individual / entity, multiple individuals / entities, or other persons, classes of individuals, or entities, all cases shall be decided between idrive and the individual only. 15.",0
"By accepting these terms, you are also acknowledging that you agree to the terms of the privacy policy.",0
Your account and the service may not meet your needs.,0
This will remove files that are no longer stored on the source computer from the account. the quota limit for sub-accounts may work differently than the regular accounts.,0
"In order to prevent unauthorized access to your account, you agree to keep your password and other account details confidential and not share them with anyone else. you, as the account holder, are solely responsible for access to, content in or sharing and use of your account.",0
Aggregate liability for all claims relating to our services will be limited to the greater of $100 or any amounts paid by you to idrive inc. for the past three months of the services in question. 14.,0
"Indemnification you will, as allowable by law, defend, indemnify and hold idrive inc., our subsidiaries, affiliates, agents, officers, licensor, directors and employees, harmless from any claim or demand, including reasonable attorneys' fees and costs, made by any third party due to or arising out of (i) your use of your account and the services, (ii) any data files and content stored by you in your account and otherwise on our servers, and (iii) any violation of these terms by you.",0
10.,0
Severability these terms will be enforced to the fullest extent permitted by applicable law.,0
(c) that the data and files you store in your account will not be lost or damaged.,1
