text,highlighted
We have no control over such third parties and assume no liability for their actions.,0
"We are not be liable if, for any reason all, any part of the site, or the site as a whole, is unavailable at any time or for any period to registered users or visitors.",0
14.&nbsp;assignment you may not assign your rights and obligations under these terms and conditions without our prior written consent.,0
Headings shall not affect the meaning of any provisions of this agreement. g. &nbsp;&nbsp;&nbsp;&nbsp;&nbsp;&nbsp.,0
Premium accounts can be revoked at any time by patook and for any reason.,0
"Those determinations may be made entirely algorithmically by analyzing some or all of your activity on the site, and we will not disclose any information or reason as to why that determination was made, or how those algorithms work.",0
Assignment.,0
E. &nbsp;&nbsp;&nbsp;&nbsp;&nbsp.,0
6. prohibited uses of the site and liquidated damages for violations no advertising or commercial solicitation.,0
"This prohibition includes marketing services, products or businesses, recruiting users for either paid or unpaid jobs (both legitimate and illegitimate jobs), recruiting for pyramid schemes, or recruiting for multi-level marketing companies.",0
Block violator's ip address and/or notify his or her internet service provider.,0
"This includes but is not limited to: creating multiple accounts to communicate with one another and figure out which messages are delivered, creating an account shortly after deleting another, contacting users to ask them if your messages are going through, or reverse engineering the code or passing special parameters to the app, experimenting with the app to try to find patterns or weaknesses (without our permission).",0
"Use the site for any illegal purpose, or upload, post, link to, copy or republish copyrighted material.",0
"The $250 in damages is a reasonable approximation of the damages that patook will incur, from lost user revenue and damage to patook's reputation, due to a breach of this paragraph.",0
Having a premium account also offers no guarantees that the site will continuously work as expected.,0
We may terminate any user account with or without notice in our sole discretion.,0
You understand that patook will not warn you before taking such actions.,0
Having a premium account offers you no waivers from any of the terms and conditions in this document.,0
Patook will not generally do this on your behalf and will not typically provide additional information unless asked by the relevant authorities.,0
You will report all violations that appear to involve the exploitation of children or underage minors to the ncmec cybertipline first.,0
"We reserve the right to determine, in our sole discretion, what constitutes ""objectionable"" material.",0
"If any part or sub-part of this agreement is held invalid or unenforceable by a court of law or competent arbitrator, the remaining parts and sub-parts will be enforced to the maximum extent possible.",0
"D.you understand that pictures or activities that appear to be of an illegal nature may be automatically or manually submitted to law enforcement authorities or other bodies such as the ncmec, sometimes solely at the discretion of automated algorithms or human moderators.",0
"&nbsp;\ you assume all risks when using the site, including but not limited to all of the risks associated with any online or offline interactions with others.",0
Patook reserves the right to conduct any criminal background check or other screenings (such as sex offender register searches) at any time using available public records.,0
&nbsp;&nbsp;&nbsp;&nbsp;&nbsp;&nbsp.,0
"Terms of idea submission you agree that: (1) your submissions and their contents will automatically become the property of patook, without any compensation to you.",0
"Accordingly, we assume no liability for any action or inaction regarding any transmission, communication or content provided by any user or third party.",0
Otherwise attempt to interfere with the proper working of the site or anyone's use and enjoyment of it.,0
13.,0
Fully cooperate with any law enforcement authorities or court order requesting or directing us to disclose the identity of anyone posting any materials on or through the site.,0
V. &nbsp;&nbsp;&nbsp;&nbsp;&nbsp.,0
"Behavior on the site and liquidated damages imposed for breaches of this agreement: a.you will only use patook to help you find platonic friendships, and not use it to flirt, hit on, or attempt to seduce other members, nor shall you approach users with ulterior motives.",0
"After your initial subscription commitment period, and again after any subsequent subscription period, your subscription will automatically continue for an additional equivalent period, at the price you agreed to when subscribing.",0
"In case any litigation specifically permitted under this agreement is initiated, the parties agree to submit to the personal jurisdiction of the courts of seattle, washington.",0
A.,0
"Premium status makes no guarantees to users that their messages will be read, that their profile will be visited, or that their experience on patook as a whole will be improved.",0
"Therefore, there is absolutely no guarantee that the person is who they claim they are, or that they are of the same age they claim to be (for example, they could be below the age of 18).",0
We do not verify the truth or accuracy of user information and have no control over user-submitted content or conduct.,0
"Enforcement of these terms and conditions is solely in our discretion, and failure to enforce the terms and conditions in some instances does not constitute a waiver of our right to enforce them in other instances.",1
"The site reserves the right, but has no obligation, to facilitate and resolve disputes between its users.",1
Verified profiles: some user profiles on the site have a verified profile tag next to them.,0
You are 18 years of age or older.,1
Ip ownership .,0
"You agree to use caution in all interactions with other users, particularly if you decide to communicate off the service or meet in person.",0
"Acceptance of the terms and conditions these terms and conditions (the ""terms"") constitute a legally binding agreement that governs your visits to www.patook.com and your use of the ios and android applications known as patook (the ""site"", or ""patook"").",0
Coupons: the site allows the use of coupons to receive additional credits.,0
"However, we cannot undertake to review all material before it is posted on the site for accuracy, and cannot ensure prompt removal of objectionable material after it has been posted.",0
"You will treat all site users and administration respectfully, online and offline.",0
You should use particular caution when accessing your account from a public or shared computer so that others are not able to view or record your password or other personal information.,0
We typically do not respond to users who have been banned.,0
We are strongly committed to protecting the intellectual property rights of others.,0
> &nbsp.,0
"We may transfer, assign or subcontract the rights, interests or obligations under the terms and conditions, at our sole discretion, without obtaining your consent.",0
I.,0
"J.if you are found to be willingly impersonating a different person, either real or invented, you agree that you will cause irreparable harm to patook but that the exact level of the harm may be difficult to ascertain.",0
"16.&nbsp;changes to the terms and conditions we update these terms and conditions every once in a while, as we deem appropriate, without notifying you.",0
When you submit content covered by intellectual property rights (e.g.,1
"It doesn't mean that the site or the company made any additional verification, nor is it a guarantee that the person's profile is genuine.",0
"The company also does not verify the statements of its users, including, but not limited to, their relationship status.",0
We may withdraw or change our site in any way we deem appropriate without any prior notice to you.,0
"Premium upgrades are non-refundable, non-transferable and cannot be exchanged for money.",0
Waiver of any part or sub-part of this agreement will not constitute a waiver of any other part or sub-part. f. &nbsp;&nbsp;&nbsp;&nbsp;&nbsp;&nbsp;&nbsp.,0
"You are responsible for ensuring that all persons who access the site through your internet connection are aware of these terms and conditions, and that they fully comply with them.",0
"A breach of this paragraph shall occur for each user you contact under the fake assumed identity.for example, should a 35-year male user posing as a 22 year old woman contact three women using that fake identity, that user will be liable for three $250 violations or $750 in total damages.",0
The sole purpose of this policy is to avoid potential misunderstandings or disputes when patook's products or marketing strategies might seem similar to ideas submitted to patook.,0
Coupons can expire at any time and often have a maximum number of uses.,0
Feedback and information any feedback you provide at this site will be deemed to be non-confidential and not proprietary.,0
"In this section, recruiting also includes: a- &nbsp;&nbsp;&nbsp;&nbsp;&nbsp;&nbsp.",0
Sending overview or informational videos to users regarding the mlm companies.,0
&nbsp;you will not advertise or solicit any user to buy or sell any products or services through the site.,0
D.&nbsp;&nbsp;&nbsp;&nbsp;&nbsp; indemnification .,0
"Please follow the terms of service above when contacting us, and do not send unsolicited ideas.",0
"We will not be liable for any loss or damage caused by a distributed denial-of-service attack, viruses or other technologically harmful material that may infect your computer equipment, computer programs, data or other proprietary material due to your use of the site or any services or items obtained through the site or to your downloading of any material posted on it, or on any site linked to it.",1
&nbsp; 7.,0
Users caught with more than one account may be permanently banned and have all their accounts disabled.,1
You agree to pay the whole amount within 30 days of receiving a notification from patook llc.,0
"In general, any kind of money-making scheme will fall under this category.",0
&nbsp; 22.,0
"We make no guarantee that we will ever respond to your message, but will typically attempt to respond to your message within a reasonable timeframe.",0
"In case of a dispute between you and us (the ""parties"") relating to or arising out of this agreement, the parties shall first attempt to resolve the dispute personally and in good faith.",0
Patook does not currently conduct criminal background screenings on its members.,0
Inviting users to informational seminars.,0
"Should this agreement, or the rights granted hereunder, by assigned, sold, leased or otherwise transferred by patook, the rights and liabilities of patook will bind and inure to any assignees, administrators, successors, and executors. d. &nbsp;&nbsp;&nbsp;&nbsp;&nbsp.",0
Access the site to build a competing service.,0
20.,0
We do not warrant that the site will meet your expectations or requirments.,1
"No claim, suit or action may be brought against us after six months from the underlying cause of action.",1
"Premium accounts certain user accounts may be upgraded to ""premium"" status.",0
C. &nbsp;&nbsp;&nbsp;&nbsp;&nbsp.,0
"Moving the conversation outside of patook and then proceeding to recruit the user, or doing points (a) and (b) above outside of patook with a user you met on patook for that purpose.",0
"You acknowledge that patook is not required to provide a refund for any reason, and that you will not receive money or other compensation for unused virtual items or subscriptions when an account is closed, whether such closure was voluntary or involuntary.",0
"If these personal resolution attempts fail, the parties shall then submit the dispute to binding arbitration.",0
Advertising: patook may from time to time choose to show advertisements on the app or website.,0
"From time to time, patook may offer products and services for purchase (""in app purchases"") through itunes,&nbsp;google play or other application platforms authorized by patook (each, a ""software store"").",0
"In general, patook does not notify any users when a ban occurs.",0
Purchases a.,0
&nbsp.,0
"Patook will be free to use and redistribute such information on an unrestricted basis, without any compensation to you.",0
"Unsolicited idea submissions patook or any of its employees do not accept or consider unsolicited ideas, including ideas for new advertising campaigns, new promotions, new or improved products or technologies, product enhancements, processes, materials, marketing plans or new product names.",0
"In the event that we fail to enforce any provision of this agreement, this shall not constitute a waiver of any future enforcement of that provision or of any other provision.",0
"You understand that patook makes no guarantee that the picture you are posting, viewing or sending is legal in nature, nor that you are legally allowed to view it.",0
D. &nbsp;&nbsp;&nbsp;&nbsp;&nbsp.,0
&nbsp; 19.,0
Paid premium upgrades have an expiration period specified in the upgrade page.,0
"In the event that you contest that a specific scheme is an mlm, patook will make the final determination as to whether that is the case.",0
"As a reasonable approximation of the damages that patook may incur from banned users creating unauthorized new accounts, you agree to pay patook the sum of $250 if you create a new account after having been banned, and an extra $250 for each subsequent account you create after being banned.",1
Https://getsupport.apple.com .,0
"In this paragraph, inappropriate pictures include but are not limited to: pictures showing your or other people's genitalia, pictures of you in underwear, pictures depicting violence or threats to other users, pornographic pictures, and any pictures of an illegal nature, such as those showing the use of illegal substances.",0
Dmca takedown requests .,0
You are solely responsible for your interactions with other users.,0
Monitoring and enforcement.,0
"Delete or alter any copyright, trademark or other proprietary rights notices from copies of materials from this site.",0
"Please check this page from time to time to take notice of any changes we may make, as they are binding on you.",0
General provisions a.,0
You cannot frame our site on any other site.,0
"You understand that patook may report you to the law enforcement authorities of your country and provide all the communications you had on the site, including your messages and physical location.",0
Please provide only specific feedback on patook's existing products or marketing strategies.,0
B.&nbsp;&nbsp;&nbsp;&nbsp.,0
You will treat all your login credentials as confidential information.,0
You are responsible for making all arrangements necessary for you to have access to the site.,0
Jurisdiction.,0
You should not provide your financial information or wire or otherwise send money to other users.,0
"However, patook reserves the right to conduct any criminal background check, at any time and using any available public records, to confirm your compliance with this subsection.",0
"Safety though patook strives to encourage a respectful user experience, it is not responsible for the conduct of any user on or off of the services.",0
4.,0
"Users who delete their account, only to create another one shortly thereafter may be permanently banned.",0
Headings for convenience only.,0
"A breach of this paragraph shall occur for each inappropriate picture sent to each user.for example, should a user send the same inappropriate messages to three users, at the same time or at different times, that user will be liable for three $250 violations or $750 in total damages.",0
Use a false name or impersonate any other person.&nbsp.,0
"Attempt to gain unauthorized access to, interfere with, damage or disrupt any parts of the site, the server on which the site is stored, or any server, computer or database connected to the site.",0
"Product feedback patook does, however, welcome your feedback regarding many areas of patook's existing business.",0
&nbsp;&nbsp.,0
You agree to cooperate with us in causing any unauthorized framing or linking and to immediately cease any such framing or linking once notified.,0
&nbsp;&nbsp;&nbsp;&nbsp;&nbsp.,0
Disclaimer of warranty a.,0
Termination a.,0
We have the right to disable any user identification provided by our site and disable your whole account on our site at any time for any reason or no reason without notice or explanation.,0
E.you will not take or share screenshots of other users' profiles or pictures with the public.,0
And (4) there is no obligation to keep any submissions confidential.,0
You understand that patook does not&nbsp;conduct criminal background checks on its users or otherwise inquire into the background of its users.,0
"The site is owned and operated by patook llc, a washington limited liability company (""we,"" ""us,"" or ""our"").",0
Venue.,0
You will report imminent threats of harm (or self-harm) to the relevant law enforcement authorities.,0
"No agency, partnership, or joint venture.",0
Neutral venue the site is a neutral venue that is not a party to any interactions or arrangements between its members.,0
5.,0
"If you choose to make an in-app purchase, you will be prompted to enter details for your account with your software store (""your iap account""), and your iap account will be charged for the in-app purchase in accordance with the terms disclosed to you at the time of purchase as well as the general terms for in app purchases that apply to your iap account.",0
We reserve the right to withdraw linking permission without notice.,0
&nbsp; 2.,0
Credits: background images purchased from shutterstock automated hotspot images downloaded from wikipedia - please click through each of them for their attribution city names on homepage provided by geonames.org,0
"You hereby waive the right to any objection of venue, including assertion of the doctrine of forum non conveniens or similar doctrine. b.",0
"You are responsible for implementing sufficient procedures to satisfy your particular requirements for personal safety, the safety of your personal information, anti-virus protection and accuracy of data input and output.",1
Deleting your account on patook or deleting the patook application from your device does not cancel your subscription.,0
"If you breach the terms of this subsection, or send or post unsolicited bulk email, ""spam"" or other unsolicited communications of any kind through the services, you acknowledge that you will have caused substantial harm to patook, but that the amount of such harm would be extremely difficult to ascertain.",0
We may choose not to deliver certain messages or all the messages you send.,1
Patook may charge you $250 for each breach of this paragraph of the terms.,0
Your payments to the site are nonrefundable.,1
Use restrictions you must not: a.,0
B- &nbsp;&nbsp;&nbsp;&nbsp;&nbsp.,0
Limitation of liability a.,0
Ii.,0
Arbitration.,0
D. &nbsp;&nbsp;&nbsp;&nbsp;&nbsp;&nbsp.,0
"Therefore, you are solely responsible for your interactions and disputes with other users.",1
"Patook algorithms or moderators will make the final decision as to whether any certain behavior reflects ulterior motives, and any users displaying such behavior may be banned from the site or blocked without notification.",0
"Headings of parts and sub-parts under this agreement are for convenience and organization, only.",0
Credits are non-refundable and cannot be exchanged for money or transferred once acquired.,0
"We reserve the right to log any attempts at taking screenshots, and to prevent your device from taking screenshots at any time and for any reason.",0
Patook llc owns all intellectual property rights to the site.,0
"These terms and conditions contain liquidated damages provisions that can be imposed on you in certain circumstances for your breach of the terms of this agreement- those liquidated damages can reach up to $250 per breach, based upon the reasonable amount of damages that we will incur as a result of a breach of these terms.",0
H. &nbsp;&nbsp;&nbsp;&nbsp;&nbsp.,0
"Some software stores may charge you sales tax, depending on where you live.",0
"Our online venue is provided to be used at your own risk, with no warranties of any kind.",0
"This limited license shall expire when you delete your content from our site, however, be advised that third parties (such as other site users) may have saved copies of your content.",0
"Should any part of these terms and conditions be rendered or declared invalid by an appropriate authority, such invalidation of such part or portion of these terms and conditions shall be limited to that particular term or condition and shall not invalidate the remaining portions thereof, and they shall remain in full force and effect.",0
Patook makes no representations or warranties as to the conduct of users.,0
&nbsp;&nbsp;&nbsp;&nbsp;&nbsp;&nbsp;&nbsp.,0
"After that time has elapsed, the user's account will revert to a standard, non-premium account and the premium features will be disabled.",0
"No agency, partnership, or joint venture has been created between the parties as a result of this agreement.",0
"You will also report any activity that appears to be illegal to the relevant authorities, before notifying patook.",0
"The arbitration shall be conducted in seattle, washington.the arbitration shall be conducted by a single arbitrator, and such arbitrator shall have no authority to add parties, vary the provisions of this agreement, award punitive damages, or certify a class.",0
Patook will retain all funds charged to your iap account until you cancel your subscription through your iap account.,0
"Through your use of the site, you agree that the laws of the state of washington shall govern any matter or dispute relating to or arising out of this agreement, as well as any dispute of any kind that may arise between you and us, with the exception of its conflict of law provisions.",0
"Profile information, photos, images), you specifically grant us a non-exclusive, perpetual, transferable, sub-licensable, royalty-free, worldwide license to display that content on our site.",1
In no event will our liability exceed the fees collected from you for the three months preceeding the time when the claim arose .,0
You will only use patook from within one of the supported states or countries.,0
"Please do not submit any unsolicited ideas, original creative artwork, suggestions or other works (""submissions"") in any form to patook or any of its employees.",0
"In the case of an issue with billing, or accidental orders, you may contact the app store owner (typically google or apple) within a few hours of purchase to request a refund (varies based on their terms of service).",0
"If you were talking to a user that was banned, patook will have no responsibility to inform you that the user was banned and what the reason was, even if it was a terms of service violation.",0
Intellectual property a.,0
"In this paragraph, impersonating a different person includes but is limited to: using someone else's pictures, lying about your gender, subtantially altering your age, pretending to be a different person that the other user may know.",0
Additional site and app specific terms and conditions: credits: the site allows for the use of credits to unlock additional features or improve existing ones.,0
You understand that patook currently does not conduct criminal background checks on its users.,0
B.,0
G. &nbsp;&nbsp;&nbsp;&nbsp;&nbsp;&nbsp.,0
"Furthermore, you will not use any information obtained from the site in order to contact, advertise to, solicit, or sell to any user without their prior explicit consent.",0
"In addition, you agree that patook may, at its discretion, notify every user you have contacted about the breach, including in said notification both your fake and real information.",0
"In addition, you agree to review and follow patook's safety tips, located on https://patook.com/legal/safety , prior to using the service.",0
"In the event that a user deletes his or her account, or is deleted by moderators of the site for any reason, all the credits associated with their account will be deleted.",0
"H.any attempt to contact users outside of the app without their explicit permission (such as for example, guessing their facebook name from their first name and city/pictures, or reading their snapchat alias off their patook profiles, and adding them as snapchat friends without having talked to them within patook) may result in an immediate ban.",0
Sub-parts and severability.,0
All claims of copyright infringement committed using our site will be investigated.any claims of copyright infringement may be reported directly to our designated copyright agent via email: copyright@patook.com .,0
L. &nbsp;&nbsp;&nbsp;&nbsp;&nbsp;&nbsp;&nbsp.,0
G. &nbsp;&nbsp;&nbsp;&nbsp;&nbsp.,0
"You should not provide your financial information (for example, your credit card or bank account information), or wire or otherwise send money, to other users.",0
You must not establish a link from any website that is not owned by you.,0
"You may link to our site in a way that is legal, fair and does not damage our reputation or take advantage of it, but you must not establish a link in such a way as to suggest any form of association, approval or endorsement on our part where none exists.",0
"As a reasonable approximation of the damages that patook may incur, you may be liable for up to $250 in liquidated damages per new account created.",0
