text,highlighted
"Patook is not liable for any failure to perform due to causes beyond its reasonable control including, but not limited to, acts of god, acts of civil authorities, acts of military authorities, riots, embargoes, acts of nature and natural disasters, and other acts which may be due to unforeseen circumstances. &nbsp; 23.",0
Only one account per user is allowed.,1
"However, you may take a screenshot of users who have talked to you and share it privately or with close friends for safety reasons.",0
"Disclose your identity to any third party who claims that material posted by you violates their rights, including their intellectual property rights or their right to privacy.",0
You understand that patook does not independently verify user ages.,0
Force majeure.,0
"If, despite our request that you not send us your ideas, you still submit them, then regardless of what your letter says, the following terms shall apply to your&nbsp;submissions.",0
Each party shall pay their own costs and fees.,0
9.,0
Banned user.,0
"F.we may ban, block, censor, redact or otherwise restrict your account or profile at any time, and for any reason we deem appropriate, without notifying you.",0
C. &nbsp;&nbsp;&nbsp;&nbsp;&nbsp;&nbsp.,0
"G. any attempt to reverse engineer the site or flirt detection algorithms will result in an immediate ban and, if done on behalf of a company or competitor, may result in legal action.",0
"In such condition, the remainder of this agreement shall continue in full force. e. &nbsp;&nbsp;&nbsp;&nbsp;&nbsp;&nbsp.",0
"By visiting the site, you agree to be bound and to the fullest extent, to abide by these terms and conditions, as well as our privacy policy available at www.patook.com/privacy.html .if you disagree with any provision of these terms or the privacy policy, you must exit the site.",0
"Terminate or suspend your access to all or part of the site for any or no reason, including without limitation, any violation of these terms and conditions.",0
"The parties agree that this choice of law, venue, and jurisdiction provision is not permissive, but rather mandatory in nature.",0
"Refunds may not be requested, and will not be granted, even if the user gets banned, blocked or otherwise restricted by patook.",0
"We may partially or entirely hide your account and activity from certain users, or from all users.",0
Linking to the site a.,0
"If you want to send us your feedback, and we hope you do, or if we ask you for feedback, we simply request that you send it to us using the form found at&nbsp.",0
We do not regularly verify personal information provided by patook users.,1
"Therefore, we disclaim any and all liability arising out of or related to user submissions, conduct and arrangements.",0
"In addition, coupons may be revoked, and cannot be exchanged for money.",0
"This can be done manually by moderators, automatically by algorithms, or in any way we deem appropriate.",0
The company is not responsible for the conduct of any user.,0
The company reserves the right to conduct any criminal background checks or other screens at any time and use any available public records.,0
No waiver.,0
"This also includes, but is not limited to, date of birth, location and age.",1
Choice of law.,0
"You also agree to report any scheme that falls under this category, and that patook will in no way be liable if you are a victim of mlm or pyramid schemes.",0
Iv.&nbsp;&nbsp;&nbsp.,0
Patook has no affiliation with the companies whose ads are shown and makes absolutely no representation as to their validity or trustworthiness.,0
"Site access by accessing the site, you represent, warrant and agree that: a.",0
H. &nbsp;&nbsp;&nbsp;&nbsp;&nbsp;&nbsp.,0
"If you wish to request a refund, please visit&nbsp.",0
C.if you are found to use this app to willingly send inappropriate pictures you agree that you will cause irreparable harm to patook but that the exact level of the harm may be difficult to ascertain.,0
"If you are banned from patook, for whatever reason, you will make no attempt to ever register an account again without patook's written express permission.",0
18.,0
They are also non-transferrable and have no cash value.,0
"Terms and conditions last modified: february 23, 2020 &nbsp; 1.",0
"&nbsp; contact us all feedback, comments, requests for technical support and other communications relating to the site should be directed to our customer service representative at info@patook.com .",0
Pyramid schemes and mlm schemes.,0
You agree to take all necessary precautions when meeting individuals through our service.,0
"For google, you may do so through google play.",0
"&nbsp; reporting of violations: you agree that you will report all violations of the terms of service to patook, and understand that failing to report may cause your account to be banned.",0
The arbitrator shall be bound by applicable and governing washington state law.,0
3.,0
"Claims necessitating arbitration under this section include, but are not limited to: contract claims, tort claims, claims based on federal and state law, and claims based on local laws, ordinances, statutes or regulations.",0
"If you purchase an auto-recurring periodic subscription through an in-app purchase, your iap account will be billed continuously for the subscription until you cancel.",0
"In no event, shall the company be liable, directly or indirectly, for any losses or damages whatsoever, general, special, compensatory, consequential, and/or incidental, arising out of or relating to your conduct or the conduct of anyone else in connection with the use of the service, including without limitation, death, bodily injury, emotional distress, and/or any other damages resulting in from communications or meetings with other users through the service.",0
"If you activate patook in a supported state or country, and then move to an unsupported state or country, you certify that you will deactivate and never use patook while in that unsupported location.",0
"This means that a picture of that user holding a ""patook"" sign was sent to a moderator and a minimal verification was done.",0
"The parties, in agreement with this sub-part of this agreement, waive any rights they may have to a jury trial in regard to arbitral claims. c. &nbsp;&nbsp;&nbsp;&nbsp;&nbsp;&nbsp.",0
"Intellectual property claims by the company will not be subject to arbitration and may, as an exception to this sub-part, be litigated.",0
"If you do not wish your subscription to renew automatically, or if you want to change or terminate your subscription, you will need to log in to your iap account and follow instructions to cancel your subscription, even if you have otherwise deleted your account with us or if you have deleted the patook application from your device.",0
Your use of the site and its content is at your own risk .,0
J.,0
"In no event will we, our service providers, employees, agents, officers or directors be liable for damages of any kind, under any legal theory, arising out of or in connection with your use, or inability to use, the site, any sites linked to it, any content on the site or such other sites or any services or items obtained through the site or such other sites, including any direct, indirect, special, incidental, consequential or punitive damages, including but not limited to, personal injury, pain and suffering, emotional distress, loss of revenue, loss of profits, loss of business or anticipated savings, loss of use, loss of goodwill, loss of data, and whether caused by tort (including negligence), breach of contract or otherwise, even if foreseeable.",0
"If you are found to be attempting to recruit users for a pyramid, marketing or other multi-layer marketing (""mlm"") scheme, you agree to pay patook the sum of $250 for each user that you contacted as a reasonable approximation of the damages that patook may incur due to you attempting to recruit another user for a pyramid marketing or other mlm scheme, even if that specific user did not reply or you did not begin recruiting them.",0
Please read carefully before accepting.,0
"We hereby disclaim all warranties of any kind, either express or implied, statutory or otherwise, including but not limited to any warranties of merchantability, non-infringement and fitness for any particular purpose.",0
Limited license .,0
Patook.com/sendfeedback .,0
"As a reasonable approximation of the damages that patook may incur, you may be liable for up to $250 in liquidated damages per violation.",0
C. we do not guarantee that any of the information provided by patook users to patook is accurate.,0
(2) patook may use or redistribute the submissions and their contents for any purpose and in any way.,0
(3) there is no obligation for patook to review the submission.,0
&nbsp;&nbsp;&nbsp;&nbsp;&nbsp;&nbsp;&nbsp;&nbsp.,0
17.,0
"As a reasonable estimation of such harm, you agree to pay patook $100 for each such unsolicited communication you send through the services.",0
"In general, the ncmec has contact information for patook staff and can get fast responses.",0
Or they may forge verification pictures.,0
E. &nbsp;&nbsp;&nbsp;&nbsp;&nbsp;&nbsp.,0
"By requesting to use, registering to use, and/or using the site, you represent and warrant that you have never been convicted of a felony and are not required to register as a sex offender with any government entity.",0
Do not disclose them to any third party.,0
The company makes no representations or warranties as to the conduct of users of their compatibility with any current or future users.,0
K. &nbsp;&nbsp;&nbsp;&nbsp;&nbsp;&nbsp.,0
"If we believe that any posted material violates any applicable law, we will remove or disable access to any such material and/or terminate or suspend the offending user's account.",1
"Post or transmit to other users any defamatory, abusive, obscene, profane, offensive, threatening, harassing, racially offensive, or objectionable material.",0
11.&nbsp;&nbsp;&nbsp;&nbsp; risk assumption and precautions.,0
"You agree that patook may take additional precautions against such behavior, including, but not limited to, publishing your information/photo/contact info on a public list of known mlm schemers, or contacting all the users you were in touch with and asking them to report you.",0
"Transmit, or procure the sending of, any advertising or promotional material and unsolicited mass communication without our prior written consent.",0
Iii.&nbsp;&nbsp;&nbsp.,0
&nbsp; &nbsp; 8.,0
We may hide your messages from certain users or all users.,0
"You agree to defend, indemnify and hold harmless the site, its affiliates and licensors and their respective officers, directors, employees, contractors, agents, and licensors from and against any claims, liabilities, damages, judgments, awards, losses, costs, expenses or fees (including reasonable attorneys' fees) resulting from your violation of these terms and conditions or your use of the site, including, without limitation, any use of the site's content, services or items purchased through the site.",1
"If you subscribed using your apple id, refunds are handled by apple, not patook.",0
Do not include any ideas that patook's policy will not permit it to accept or consider.,0
"We do not guarantee that the information provided on the site is complete, accurate or up-to-date.",0
12.,0
Take appropriate legal action as may be necessary.,0
C- &nbsp;&nbsp;&nbsp;&nbsp;&nbsp;&nbsp.,0
You are solely responsible for your personal safety and the security of your personal information.,0
Your continued use of the site following the posting of any revised or updated terms and conditions constitutes your acceptance of the changes.,0
"Disputes between users as a neutral venue, we do not offer mediation, arbitration or any other forms of dispute resolution and do not actively monitor user interactions.",0
"Introduce any viruses or other harmful material, use any device, software or routine that interferes with the proper working of the site.",0
We then post the changes on this page.,0
In app purchases.&nbsp.,0
"For example, users may provide verification and then change their picture to something else.",0
The refund would then be at their discretion.,0
"You may not transmit any chain letters, junk or spam e-mail to other users.",0
"This agreement, or the rights granted hereunder, may not be assigned, sold, leased or otherwise transferred in whole or part by you.",0
"Site contents, look and feel, features, design, and registered and unregistered trademarks are protected by the u.s. and international copyright, trademark, trade secret, and other intellectual property or proprietary rights laws.",0
F. &nbsp;&nbsp;&nbsp;&nbsp;&nbsp;&nbsp.,0
&nbsp; 2 1.,0
&nbsp; 15.&nbsp;severability and non-waiver a.,0
"We are not liable for any property damage, bodily injury or death of the site user or any third party.",0
10.,0
"We have the right to take any action that we deem necessary or appropriate if we believe that a user violates the terms and conditions, infringes any intellectual property right or other right, threatens the personal safety of users of the site and the public.we may take any action, including but not limited to: i.",0
