text,highlighted
"To learn more about the dmca, click here. under canadian copyright laws, remind is required to forward any notice from a copyright owner to a remind user located in canada if the copyright has notified remind in accordance with the requirements under the canadian copyright act.what this is sayingsee something that belongs to you, but someone else posted it?",0
"What this is sayingwe work hard to improve the remind experience for you, so our terms may change from time to time.",0
Your use of the services in any way following notification by remind constitutes your acceptance of the terms and conditions as modified.,0
"You hereby grant remind a non-exclusive , worldwide, royalty-free, perpetual, irrevocable, sublicensable and transferable (only to a successor) right and license to use your user submissions for any purpose related to providing and/or improving the services (however, remind will only share your personally identifiable information in accordance with remind's current privacy policy).",0
"Remind may disable or terminate your access to the services or your account at any time, for any reason (for your violation of any term of this agreement or without cause), and without warning or notice, which may result in the forfeiture of all information associated with your account.",0
"Also, be sure to read our community guidelines, which include best practices for how to keep the remind community safe.",0
All registration information you submit is accurate and truthful.,0
Safety help center blog certified bycertified by,0
"If you continue to use any service or feature after you have been notified of any applicable fees, that use constitutes your acceptance of any new or increased fees. through remind, you may be able to access and use products or services operated by other individuals or companies who are not employed or controlled by remind (such as, a payment platform to request and/or make payments).",0
"An emergency meriting a message shall be determined solely by your teacher, organizer, school or district or any official designated by a school or district, or a government agency.",0
"All materials displayed or performed or available on the services (including, but not limited to text, graphics, data, articles, photographs, images, illustrations, user submissions (defined below), and so forth (all of the foregoing, the ""content"")) are protected by copyright and other intellectual property laws.",0
What effects the content may have on you.,0
You may terminate your use of the services or your account at any time by deleting your account in your account settings tab or by contacting us at rmd.me/help.,1
"If you do not unconditionally agree to all the terms and conditions of the agreement, you may not use the services. terms of usewelcome to remind.",0
This app works best with javascript enabled.schools &amp.,0
"The services, content, and any software are provided on an ""as is"" basis, without warranties or conditions of any kind, either express or implied, including, without limitation, implied warranties of merchantability, merchantable quality, fitness for a particular purpose, non-infringement, or that use of the services will be uninterrupted or error-free.",0
"If you're under 18, a parent or guardian needs to review and agree to these terms for you.",0
We need your help to keep the remind community safe!,0
Or use a name subject to any rights of any person other than you without appropriate authorization.,0
"If you're agreeing to this agreement on behalf of an organization or entity, you represent and warrant that you are authorized to agree to this agreement on the organization or entity's behalf and bind them to this agreement (in which case, the references to ""you"" and ""your"" in these terms, except for in this sentence, refer to that organization or entity).",0
"In order to provide you with the services, remind needs to access and use your user submissions in certain ways.",1
You can opt out of receiving these phone calls only by having the authorized administrator at your school or district remove your contact information from their school information system.,0
"Residents of the european union (âeuâ), european economic area (âeeaâ), or united kingdom (âukâ) may read about our additional commitments concerning your privacy by reviewing our pledges to the principles embodied in the eu-us and swiss-us privacy shield agreements remind.com/privacy-policy#privacy-shield and how remind complies with the requirements of the euâs general data protection regulation remind.com/privacy-policy#gdpr.",0
Weâll make it clear when fees are added to remind.,0
"What this is sayingwe're here to help if there are issues, but there are no warranties relating to our services or any products you access through remind.",0
"Please continue reading to learn about the rules and restrictions that govern your use of remindâs website(s) and all other products, services and applications made available by remind from time to time (collectively, the âservicesâ).",0
"While we are here to support you, we are not liable for anything that happens because of our service.",0
"Any and all such charges, fees, or costs are your sole responsibility.",0
"If you are retained by remind to work with students to advance their education, you are a coach.",0
It is the express wish of the parties that this agreement and all related documents be drawn up in english.,0
"If the terms of this agreement are considered an offer, acceptance is expressly limited to such terms.",0
You may not: select or use the name or email of another person with the intent to impersonate that person.,0
"If you use any of these products or services, you must review and agree to the additional terms and conditions and privacy policy, as well as pay any applicable fees required to use those products.",0
"If you are purchasing an individual account, you are a premium organizer.",0
"""crawls,"" ""scrapes,"" or ""spiders"" any page, data, or portion of or relating to the services or content (through use of manual or automated means).",1
"All provisions of this agreement which, by their nature, should survive termination, will survive termination, including, without limitation, ownership provisions, warranty disclaimers, and limitations of liability.",0
"If you are dissatisfied with our services, we will discuss in arbitration to resolve any issues.",0
What this is sayingbe sure to only share content that belongs to you.,0
"If there is a dispute between remind users, or between remind users and any third party, you understand and agree that remind is under no obligation to become involved.",1
"By accessing or using the services in any manner, you agree that you have read and agree to be bound by the terms and conditions of this agreement to the exclusion of all other terms.",0
"Remind is not responsible for messages sent erroneously or for the content of any message sent as an emergency message, even when the content of that message contains information that is incomplete, confusing, or erroneous.",0
"The services may contain, or direct you to websites or services containing, information that some people may find offensive or inappropriate.",0
"What this is sayingwe are letting you know that in the event of an emergency, determined by those individuals in your school, school district, community or a government official and not remind, you may receive emergency messages from us in addition to other remind users.",0
"Notwithstanding the foregoing, each party will have the right to institute an action in a court of proper jurisdiction for injunctive or other equitable relief pending a final decision by the arbitrator.",0
"Remind is a messaging platform that helps educators, students, parents and other users send quick, simple messages to any device and for students to gain access to coaching to advance their learning.",0
"We collect these in order to notify the parent that we may contact the child for the purpose of providing the services for which the child's teacher, organizer (as described below) or school administrator has signed up to use.",0
Remind may also send other administrative messages.,0
"If you are a teacher, coach or parent who creates a âclassâ or âgroupâ of members, then you are an organizer.",0
Remind may disable or terminate your account if you do so.,0
"Is harmful, fraudulent, threatening, abusive, harassing, tortuous, defamatory, vulgar, obscene, libelous, or otherwise objectionable as reasonably determined by remind .",0
"While remind provides schools and districts with the ability to send emergency messages through remind, remind is neither responsible for your receipt of or failure to receive a message, nor your actions, failure to act or the actions or inactions of others in response to any emergency message.",0
You can learn more here.,0
What this is sayingplease keep in mind that you are solely responsible for your use of remind.,0
"This agreement is void where prohibited by law, and the right to access the services is revoked in such jurisdictions.",0
Fees and payment.,0
"Runs maillist, listserv, any form of auto-responder or ""spam"" on the services, or any processes that run or are activated while you are not logged into the services, or that otherwise interfere with the proper working of the services (including by placing an unreasonable load on the services' infrastructure).",0
"For remind to collect this type of personal information, a studentâs school, district or teacher must agree to obtain parental consent for that child to use the services, or remind must obtain that consent.",0
What this is sayingwe're letting you know that you may periodically receive messages from us in addition to other remind users.,0
"By using the services, you expressly relieve and hold harmless remind from any and all liability arising from your use of any third party services.",0
Terminationthis agreement will remain in full force and effect while you use the services.,0
"Remind makes no representations, warranties, or conditions regarding suggestions or recommendations of services or products (including content provided by users) offered or purchased through the services.",0
You also represent and warrant that you are entering into these terms on behalf of your school or district.,0
You agree that remind will not be responsible or liable for any loss or damage of any sort incurred as the result of any such dealings.,0
"Copyright dispute policy under american copyright law, the digital millennium copyright act (the ""dmca""), online service providers such as remind have the right, but not the obligation, to remove material that allegedly violates someone's copyright.",0
We've provided instructions on how to easily unsubscribe and stop receiving messages.,0
"Please keep your password safe, use your real name and create your own account before using remind.",1
"Remind may use the information you upload to the services in order to verify organizersâ and participantsâ affiliations and otherwise to help us provide you with the services. with respect to all users of remind, whether you are a participant, organizer or organization, premium organizer, verified administrator, or coach: if you invite or add anyone to use remind and/or use any feature of the services which requires sharing personal information of anyone (including, without limitation, if you import contacts from your address book to the services), you represent and warrant that you have obtained freely given, informed consent from each person to: receive such invitation and be added to the services; receive messages from remind, other participants of the class or group, and others who have access to your class or group (such as, organizers and verified administrators).",0
You will always have the choice whether to use those features.,0
"You will be responsible for withholding, filing, and reporting all taxes, duties and other governmental assessments associated with your activity in connection with the services.",0
"(note for auditing purposes and to comply with laws, we may still keep a copy of messages and account details after an account is deleted or disabled).",0
"When you access third party services, you do so at your own risk.",0
We'll provide you notice when we make a material change to the services that would adversely affect you.,0
"If you plan to broadly or publicly publish these codes, you must manage the accuracy of your subscriber lists carefully. it's your responsibility to maintain and monitor the accuracy of list of participants for each of your classes or groups. if you are connected to an organization on a remind plan you may receive additional privileges from a verified administrator of your organization.",0
"Limitation of liabilityto the fullest extent allowed by applicable law, in no event will remind or its suppliers or its service providers, or their respective officers, directors, employees, or agents be liable with respect to the services or the subject matter of this agreement under any contract, negligence, tort, strict liability or other legal or equitable theory: for any amount in the aggregate in excess of the greater of $100 or the fees paid by you to remind hereunder during the 12-month period preceding the applicable claim.",0
"You should consult with your wireless carrier to determine what rates, charges, fees, or costs may apply to your use of the services. additionally, we have created additional plans for schools and districts that want additional features.",0
"In all cases, you need consent from every person you wish to add, invite, or send messages to via remind.registration and securityas a condition to using services, you may be required to register with remind by selecting a password and providing your name and a valid email address.",0
"Some states do not allow the exclusion or limitation of incidental or consequential damages, so the above limitations and exclusions may not apply to you.",0
"Remind only collects personal information through the services from a child under 13 where that student's school, district and/or teacher has agreed, via the terms described below, to obtain parental consent for that child to use the services and disclose that personal information to remind.",0
Remind also complies with the uk data protection act 2018.,0
We will charge fees to schools or districts that sign contracts to purchase our school or district plans.,0
"For example, we will report all images including nudity of minors or suspected minors unless they are clearly related to academic study of subjects such as art, biology or medicine.",0
"Remind may transfer, assign or delegate this agreement and its rights and obligations without consent.",0
"Some jurisdictions do not allow limitations on how long an implied warranty lasts, so the above limitations may not apply to you.",0
"Upon termination of your account, your right to use the services and any content will immediately cease.",0
We need to work together to ensure remind is a secure and supportive environment.,0
"When an organizer adds a new participant to a class or group, that participant will receive a welcome message, instructions on how to stop receiving messages, and information on how to avoid certain charges by downloading the remind application.",0
"If you are a teacher or a school providing consent on behalf of parents, you are also responsible for complying with coppa.",0
Remind reserves the right to refuse registration of or to cancel a remind account in its sole discretion.,1
You acknowledge that all content accessed by you while using remind is at your own risk and you will be solely responsible for any resulting damage or loss.,0
"Your interactions with organizations and/or individuals found on or through the services, including payment and delivery of goods or services, and any other terms, conditions, warranties or representations associated with such dealings, are solely between you and such organizations and/or individuals.",0
"Please read our privacy policy, located at remind.com/privacy-policy.",0
"Note, if you become a participant through an organization, and you request that remind delete your account, remind may notify the organization (and the organizers of the classes or groups you are in of your deletion request.",0
"And provide that person's personal information to remind. what this is sayingyou have different rights and responsibilities depending on what type of user you are: organizer, participant, organization, premium organizer, verified administrator, or coach.",0
"Choice of law and arbitration this agreement will be governed by and construed in accordance with the laws of the state of california without regard to the conflict of laws provisions thereof, unless a state's laws explicitly require that any legal disputes are governed by the laws of that state.",0
"You will be responsible for obtaining and maintaining any equipment or ancillary services needed to connect to, access, or otherwise use the services, including, without limitation, modems, hardware, software, and long distance or local telephone service.",0
"We may suspend or discontinue any part of the services, or we may introduce new features, impose limits on certain features or restrict access to parts or all of the services at any time.",0
"Except as expressly set forth below, we do not knowingly collect or solicit personally identifiable information from a child under 13.",0
"If you connect to or use any third party services in conjunction with remind, you acknowledge and consent to receive notifications and messages from those third party services.",0
We will notify you when we intend to charge for a service or feature.,0
"This agreement is not assignable, transferable or sublicensable by you except with remind's prior written consent.",0
"Responsibility for usage chargesaccess to and use of remind itself is free, but we do offer additional features that require fees.",0
"To stop receiving phone calls, you need to talk to your school or district.contentyou agree that you may only use the services in accordance with remind's community guidelines.",0
"You agree to indemnify and hold remind harmless for and against any and all claims, liabilities, damages (actual and consequential), losses and expenses (including attorneysâ fees) arising from or in any way related to your breach of the foregoing.",0
"Districtshigher edteachersfamiliespartners|remind coachinglog insign uplog interms and policiesterms terms of service school agreement district agreement data practices policies privacy policy community guidelines anti-bullying policy security security overview terms of service importantâ if you are under the age of 18, you must have your parent or guardian read the agreement below and agree to it for you.",0
"If we learn we have collected personal information from a student under 13 other than pursuant to the above, or if we learn a student under 13 has provided us personal information beyond what we request from him or her, we will delete that information as quickly as possible.",0
Computer deletion is not an instantaneous process.,0
"Jeopardizes the security of your account in any way, such as allowing someone else access to your account or password.",0
Policies product schools &amp.,0
You may choose to use and pay for additional products and services that we or our partners offer.,0
"As we explain in our privacy policy, if remind knows or becomes aware of a security breach of its users' personally identifiable information, remind will notify affected users or post a notice on the services as required by applicable law(s).",0
"To permanently cease receiving sms text messages, please text @stopall: in reply to any sms message from that class or group, to a remind long-code (a phone number issued by remind), or in the us, to the remind short code 81010. for more information see this link. if you are located in canada, you may opt out of receiving marketing messages (including text messages and emails).",0
"Because remind does not control whether to send or not send an emergency notification, remind is never responsible for your receipt of, or failure to receive an emergency message.",0
For data loss or cost of procurement of substitute goods or services.,0
"Violation of any of the foregoing may result in immediate termination of your account, revocation of your ability to use the services, and may subject you to state and federal penalties and other legal consequences.",0
"You may only use the services for your own personal, non-commercial (meaning, you may not leverage the services as a separate business) use and only in accordance with the terms of this agreement and all laws that apply to you.",0
You retain ownership of all of your user submissions.,1
"If you don't get your parent or guardian to read and agree to this, you don't have permission to use remind.",0
"You also certify that you are legally permitted to use and access the services and take full responsibility for the selection, use of, and access to the services, including ensuring that you have permission to communicate with anyone you choose to interact with through the services.",0
"In the course of using the services, you may provide information which may be used by remind in connection with the services and which may be visible to certain other users.",0
This agreement and any subsequent versions of this agreement posted to the services will be deemed a writing signed by both parties.,0
Privacywe take the privacy of our users very seriously.,0
You will be responsible for maintaining the confidentiality of your account and password.,1
"To permanently cease receiving sms text messages, please text @stopall: in reply to any sms message from that class or group, to a remind long-code (a phone number issued by remind), or in the us, to the remind short code 81010.",0
"For more information see this link. if the authorized administrator at your school or district is sharing information from the school information system with remind, you will receive emergency messages as phone calls to the phone number you have on record with your school or district.",0
"If you are a school, district, or teacher providing consent on behalf of parents or guardians, you may be required to provide adequate school credentials and a valid school email address to verify your identity.",0
Remind reserves the right to terminate access of any third party application or service to our published or unpublished apis.,0
You release remind from all liability for you having acquired or not acquired content through the services.,0
"By signing up for the services, you agree to receive emergency communications from remind whenever it is determined that circumstances merit those communications.",0
Remind is not responsible for your use of the services in any way that breaks the law.,0
"By signing up for the services, you agree to receive communications from remind as well as class or group organizers and participants, and you represent and warrant that each person you invite and/or add has consented to receive communications from you and remind.",0
"Your restrictions and responsibilitiesyou warrant, represent and agree that you will not contribute any content or otherwise use (or encourage anyone else to use) the services in a manner that: infringes or violates the intellectual property rights or proprietary rights, rights of publicity or privacy, or other rights of any other third party.",0
"If you don't agree with the new terms, you may reject them but unfortunately you will no longer be able to use the services.",0
"Any dispute arising from or relating to the subject matter of this agreement will be finally settled in small claims court or by arbitration in san francisco, california or in a location that is reasonably convenient for you, using the english language in accordance with the arbitration rules and procedures of judicial arbitration and mediation services, inc. (""jams"") then in effect, by one commercial arbitrator with substantial experience in resolving intellectual property and commercial contract disputes, who will be selected from the appropriate list of jams arbitrators in accordance with the arbitration rules and procedures of jams.",0
"If you believe that a student under 13 may have provided us personal information in violation of this paragraph, please contact us at rmd.me/help.",0
Or what actions you may take as a result of having been exposed to the content.,0
You will maintain the accuracy of such information.,0
"Remind reserves the right (but does not have the obligation) to remove any content from the services at any time, for any reason (including, but not limited to, if we receive claims or allegations from individuals, companies or authorities relating to that content or if remind is concerned that you may have breached the foregoing restrictions), or for no reason at all.",1
"What this is sayingwhile using remind, you may be able to access or use third party services that arenât part of our product (such as youtube, flickr, video conferencing, whiteboarding, etc.).",0
What this is sayingthe security of your account is very important to us.,0
"In addition, remind will not and cannot monitor, verify, censor or edit the content of any third party services.",0
"If you are agreeing to this agreement on behalf of an organization, such as a school or school district, club, or team, you are an organization.",0
We do not want you to opt out of these messages as your schools or district may wish for you to receive an emergency message.,0
