text,highlighted
"Verified administrators may be able to add, remove, and/or move you from classes or groups within the same organization. if you are accessing the services as an organizer (such as a teacher, administrator, parent or other adult creating a class or group) and inviting users to join as participants: the services may allow you to invite users to join and/or to add users to your class(s) and/or group(s). you can invite participants and other organizers to your class or group by distributing ""class codes"" or ""group codes"", and communicate with those users, (in some cases, there may be more than one organizer per class/group). you may only share class or group codes with participants and organizers whom you wish to subscribe to your class/group.",0
"If you don't follow these terms of service and/or cause harm to anyone, it's your responsibility to resolve.",0
"Will these terms ever change?we constantly try to improve our services, so we may update this agreement as we offer new and improved services.",0
What content you access via the services.,0
"If you cannot afford or otherwise do not want to pay arbitration filing, administrative, hearing and/or other fees and cannot obtain a waiver of fees, we will consider in good faith any request by you for us to bear the cost of those fees.",0
You may not transfer your account to anyone without express prior written consent of remind.,0
"No agency, partnership, joint venture, or employment is created as a result of this agreement and you do not have any authority of any kind to bind remind in any way whatsoever.",0
"Attempts, in any manner, to obtain the password, account, or other security information from any other user.",0
"Note that if the remind account of a child under 13 is inactive for at least twelve months (meaning, that account has not received a message through the remind services in that time), remind's policy is to delete the personally-identifiable information associated with that child's account.",0
"You agree to indemnify and hold remind harmless for and against any and all claims, liabilities, damages (actual and consequential), losses and expenses (including attorneysâ fees) arising from or in any way related to your receipt of emergency messages or your failure to receive an emergency message. while we strongly encourage you not to, you may opt out of receiving emergency messages as sms text messages or emails, but not phone calls.",0
"We respect others' intellectual property rights, and we reserve the right to delete or disable content alleged to be infringing, and to terminate the accounts of repeat alleged infringers.",0
You should make whatever investigation you feel necessary or appropriate before proceeding with any online or offline transaction with any third parties.,0
"If you choose to terminate your account, all data will be rendered unavailable to you immediately and your data will be deleted over time as is true of all computer deletion everywhere.",0
"For children under 13 we may collect a child's name (first name and last initial), date of birth, email address or telephone number, and the child's parent's email address.",0
You can let us know by using our copyright dispute policy.,0
We will update you when we make significant changes.,0
"Violates any law, statute, ordinance or regulation.",0
Copies or stores any significant portion of the content.,0
"If at any time you learn that a user of the services claims to be affiliated with your organization but is not, in fact, affiliated with your organization, or of any other inaccuracy relating to your organizationâs information, you will remove that user from your organization and, if appropriate, notify remind immediately by visiting rmd.me/help. if you purchase an individual plan, you are a premium organizer, which gives you access to premium features, such as: delivering sms messages to carriers that are blocked for free users, and delivering messages with extended length. if remind verifies you as a verified administrator of your organization, you may have the ability to perform the following tasks: invite and add organizers and participants to the services, view and manage users and information affiliated with your organization, add, move, or remove organizers and participants from classes and/or groups affiliated with your organization, connect and upload or sync information relating to organizers, participants, classes and/or groups using a data upload or syncing mechanism (such as, using csv upload or through integration with your school information systems (sis)), join classes and groups created by organizers affiliated with your organization, communicate directly with other users affiliated with your organization, access and manage information and user submissions, and view the contact information, which will include personally identifiable information, of all remind users connected with your school or district, as appropriate, and see which of those users received communications from your school or district. if you choose to do any of the above, you represent and warrant that you have all rights and have obtained all consents and authorizations necessary to perform such tasks and that you will only use personal information in accordance with applicable privacy laws.",0
"Remind will not be liable for any failure to perform its obligations hereunder where such failure results from any cause beyond remind's reasonable control, including, without limitation, mechanical, electronic or communications failure or degradation.",0
"Additionally, remind cannot guarantee the authenticity of any information which users may provide about themselves.",0
"If we don't have consent from a parent or guardian, we delete the information.",0
Remember that communications with others in which you participated will remain available to those other users.,0
"We may view and/or use content you post on remind (for example, format a message you send and display it to the recipients)âbut you still own it.",0
"Decompiles, reverse engineers, or otherwise attempts to obtain the source code or underlying ideas or information of or relating to the services (or the products of remind's third party service providers).",0
"Please read on below to find out what additional terms apply to you. if you are a participant (such as a student, parent, or other individual invited to join a class or group by an organizer): you must get your parent or guardian to read and agree to this agreement before using the services if you are younger than 18. you will only join schools, classes and/or groups to which you have been invited, or to which you belong. in certain cases, you may be invited to join a class or group by another participant who is already a member of that class or group. the organizer and other participants of your class or group may be able to view information (including your personally identifiable information but not personal contact information), as well as your user submissions (defined below). if you are connected to an organization that has purchased a plan from remind, verified administrators of the organization will be able to see and edit your contact information.",0
"For more information on coppa, please click here.",0
Remind reserves the right to charge fees for certain features.,0
"Because your user submissions may be viewed or accessed by other remind users, you grant other remind users a nonexclusive, worldwide, royalty -free, perpetual, irrevocable, sublicensable right and license to access, view, edit, and use your user submissions as may be permitted through the functionality of the services (for example, when you send a message through the services, the recipients of your message will be able to save, copy, edit and store that message).",0
"What this is saying before using remind, you need to be at least 18 years old and agree to these terms.",0
"Under no circumstances will remind be liable in any way for any content, including, but not limited to, any errors or omissions in any content, or any loss or damage of any kind incurred in connection with your use of or exposure to any content posted, emailed, accessed, transmitted, or otherwise made available via the services.",0
"You, not remind, remain solely responsible for all content that you upload, post, email, transmit, or otherwise provide using, or in connection with, the services, and you warrant that you possess all rights necessary to provide such content to remind and to grant remind the rights to use such information as provided herein.",0
"Products and services purchased or offered (whether or not following such recommendations and suggestions) the services are provided as is without any warranty or condition of any kind, either express or implied, from remind or anyone else.",0
Districts higher education teachers families partners remind coaching company about us careers become a coach press resources community engagement ratings connected educators trust &amp.,0
"This agreement includes the terms in this document, as well as remindâs privacy policy, copyright dispute policy, and the apple application terms.",0
"For any indirect, incidental, punitive, or consequential damages of any kind whatsoever.",1
Remind cannot guarantee the identity of any other users you may interact with in the course of using the services.,0
"Consent to receive periodic messagesas part of the services, you will receive communications through the services, including messages that remind sends you (for example, via sms, emails, and push notifications).",0
You will be responsible for ensuring that such equipment or ancillary services are compatible with the services.,0
"Remind reserves the right, but will have no obligation, to investigate your use of the services in order to determine whether a violation of the agreement has occurred or to comply with any applicable law, regulation, legal process or governmental request.",0
It's important that you get prior consent from everyone you invite or add to remind.,0
"If you are a teacher, organizer, verified administrator, school or district official you represent and warrant that each person you invite and/or add has consented to receive communications from you and remind.",0
"The studentâs school, district or teacher may disclose that personal information to us for a legitimate educational interest. if you are a school, district, or teacher, you represent and warrant that you are responsible for complying with coppa in cooperation with remind, meaning you must obtain consent from all parents or guardians whose children under 13 will be accessing the services or work with remind to ensure remind has obtained all necessary consents.",0
"Remind has no control over, and assumes no responsibility for, the content, accuracy, privacy policies, or practices of or opinions expressed in any third party services.",0
"While we delete the account in these situations, some of the child's data may persist in the files of remind's agents or service providers for some period of time until it is removed from their systems as well.",0
"We may modify this agreement at any time, but we will do our best to bring this to your attention by posting a notice on the services or notifying you by email or by some other means.",1
"Miscellaneousthe failure of either party to exercise, in any respect, any right provided for herein will not be deemed a waiver of any further rights hereunder.",0
"We promise :)additional termsthis agreement applies to all users of our services, but there are special terms for you depending on what type of user you are and whether you use the service for free, as do the vast majority of our users, or pay for use of remind. if you are, for example, a student, teammate or parent who is invited to be or added as a member of a class or group by an organizer, you are a participant.",0
You will receive these phone calls even if you opt out of receiving sms text messages on remind.,0
"Always get an adult's permission before going online. please read these terms of use (""agreement"") carefully before using the services offered by remind101, inc. (""remind"" or ""we"" or ""us"").",0
"Judgment upon the award so rendered may be entered in a court having jurisdiction, or application may be made to such court for judicial acceptance of any award and an order of enforcement, as the case may be.",0
"You acknowledge that remind has no control over, and no duty to take any action regarding: which users gains access to the services.",0
"If you would like to stop receiving messages, click here for instructions.",0
"If you see someone violating our guidelines or terms of use, please contact us immediately at report@remindhq.com.",0
Remind may inform participants who have not replied that they will automatically be removed from the class or group.,0
"If you don't follow our guidelines or these terms of use, we may need to remove any inappropriate content, deactivate your account, and, in extreme circumstances, report your content to law enforcement.",0
"Third party service providersthe services may contain links to third party websites, products or services that are not owned or controlled by remind (""third party services"").",0
"Remind makes no representations concerning any content contained in or accessed through the services, and remind will not be responsible or liable for the accuracy, copyright compliance, legality or decency of material contained in or accessed through the services.",0
"If you are a staff member of a school or school district that has purchased a paid school or district plan, and have been given administrative rights, then you are a verified administrator.",0
"By agreeing to these terms, you acknowledge that you may not participate in a class action in court or in arbitration, either as a class representative, class member or class opponent.",0
"You agree you will abide by all copyright notices, trademark rules, information, and restrictions contained in any content accessed through the services, and will not use, copy, modify, publish, distribute, upload, display, license, sell or otherwise exploit for any purposes whatsoever any content, third party submissions or other proprietary rights not owned by you: without the express prior written consent of the respective owners, and in any way that violates anyone else's (including remind's) rights.",0
"Both parties agree that this agreement is the complete and exclusive statement of the mutual understanding of the parties and supersedes and cancels all previous written and oral agreements, communications and other understandings relating to the subject matter of this agreement, and that all modifications must be in a writing signed by both parties, except as otherwise provided herein.",0
What this is sayingyou can delete your remind account online at any time.,0
Remind's mechanisms and policies for compliance with coppa meet or exceed the requirements of the european union's general data protection regulation for the protection of the personal data of children.,0
"What this is sayingremind cares about children's privacy, and complies with coppa, a law created to protect the privacy of minors.",0
What this is sayingwe are serious about safety.,0
"If you are a california resident, you will and hereby do waive california civil code section 1542, which says: ""a general release does not extend to claims which the creditor does not know or suspect to exist in his favor at the time of executing the release, which, if known by him must have materially affected his settlement with the debtor.""",0
Remind encourages you to be aware when you leave the services and to read the terms and conditions and privacy policy of each third party service that you visit or use.,0
"However, you may still receive text message and email communications that are necessary for the services or otherwise exempt from anti-spam laws.",0
"Consent to receive emergency messagesas part of the services you may receive communications through the services in the event of an emergency, through sms (text messages), emails, push notifications, or phone call.",0
"We will pay any administration fee, arbitration fees and fees and charges of attorneys, experts and witnesses if and to the extent we are required to pay such fees and charges by law or in order to make this arbitration provision enforceable.",0
"You will not link to the services without remind's prior written consent, except in accordance with the terms of this agreement.",0
"Accordingly, you acknowledge that you may not have access to a court (other than a small claims court) or to a jury trial.",0
"Câest la volontã© expresse des parties que la prã©sente convention ainsi que les documents qui sây rattachent soient rã©digã©s en anglaise what this is sayingeffective date april 30, 2021updated may 1, 2021 terms &amp.",0
"We take extra steps to be able to lawfully transfer the personal data of eu, eea, or uk residents to the us and to comply with the euâs and ukâs privacy regulation and law.use by childrenthe children's online privacy protection act (""coppa"") requires that online service providers notify parents of children in the united states and obtain their consent before they knowingly collect personally identifiable information online from children who are under 13.",0
This is a binding agreement between you and remind.,0
"Indemnity you will indemnify, defend and hold remind, its parents, subsidiaries, affiliates, officers, and employees harmless (including, without limitation, from all damages, liabilities, settlements, costs and attorneys' fees) from any claim or demand made by any third party due to or arising out of your access to or use of the services, your violation of this agreement, or the infringement by you or any third party using your account of any intellectual property or other right of any person or entity.",0
Often when an emergency is suspected the individuals empowered to determine whether to send an emergency message through remind may have incorrect or only partial information.,0
"You represent and warrant to remind that: you are at least 18 years old (or, if you are not at least 18 years old, you have your parent's permission to use the services, and your parent has read and agrees to this agreement on your behalf).",0
"Before continuing to use remind, it will be important to review and agree to any changes.",0
Or for any matter beyond remind's reasonable control.,0
"You may learn about the school and district plans here: remind.com/plans.what this is sayingremindâs basic service is free right now, and we have no plans to charge users for the basic service.",0
"You alone can determine what, if any, actions to take in the event of an emergency or in response to an emergency message you receive through remind.",0
"In the event that you have a dispute with one or more other users, you hereby release remind, its officers, employees, agents, and successors in rights from claims, demands, and damages (actual and consequential) of every kind or nature, known or unknown, suspected or unsuspected, disclosed or undisclosed, arising out of or in any way related to such disputes and/or our service.",0
You may not sign up for or use the services as someone you are not.,0
We canât be held responsible for the content of services or any issues that arise.warranty and disclaimerremind has no special relationship with or fiduciary duty to you.,0
We collect limited information for under-13 users and only if we have parental consent.,0
"Remind utilizes standard contractual clauses provided by the eu and approved by the ukâs information commissioner's office to effectuate lawful transfers of the personal data of residents of the eu, eea, or uk to the united states for processing.what this is sayinganother important document to look at is our privacy policy, which outlines what personal information remind collects from you and how we use that information to provide our service.",0
What this is sayingremind is a communication tool.,0
How you may interpret or use the content.,0
What this is sayingwe want you to have a great experience on remind.,0
"Violates the security of any computer network, or cracks any passwords or security encryption codes.",0
"If you are a teacher, you represent and warrant that you are authorized by your school or district to use the services.",0
We may collect personal information through the services from a child under 13 but only in support of the learning environment.,0
"However, remind may retain messaging data or other data and information pursuant to this agreement, as necessary for auditing purposes, and as required by law.",0
"Any information you agree to provide will be governed by that business' privacy policy. note that, by using the services, you may receive e-mail or text messages on your phone or mobile device, which may cause you to incur usage charges or other fees or costs in accordance with your wireless or data service plan.",0
"If any provision of this agreement is found to be unenforceable or invalid, that provision will be limited or eliminated to the minimum extent necessary so that this agreement will otherwise remain in full force and effect and enforceable.",0
All information publicly posted or privately transmitted through the services is the sole responsibility of the person from which such content originated and that remind will not be liable for any errors or omissions in any content.,0
"You will provide remind with accurate, complete, and updated registration information.",0
"However, we provided instructions on how to easily unsubscribe and stop receiving sms text messages and emails.",0
"These privileges may include access to information and user submissions (defined below) (including personally identifiable information but not personal contact information) of participants and other organizers in your class, group or affiliated organization. if you are connected to an organization on a remind plan, verified administrators of that organization may be able to join or message members of your class or group, add or update information in your remind account profile, add, move or remove you from classes or groups affiliated with the organization, and/or take other actions relating to your access and use of the services through the organization. if you are an organization (such as a school, school district or club): you are responsible for maintaining the accuracy of the information relating to your organization.",0
"Anything you post, upload, share, store or otherwise provide through the services are, together with any related intellectual property rights, your ""user submissions.""",0
