"The services are provided “as is,” without warranty of any kind."
"You will indemnify and hold harmless figma and its officers, directors, employees, and agents, from and against any claims, disputes, demands, liabilities, damages, losses, and costs and expenses, including, without limitation, reasonable legal and accounting fees, arising out of or in any way connected with (i) your access to or use of the services."
"In no event will figma or suppliers’ total liability arising out of or in connection with these terms or from the use of or inability to use the services exceed the amounts you have paid to figma in the preceding twelve months for the services, in no event will figma or suppliers’ total liability arising out of or in connection with these terms or from the use of or inability to use the services exceed the amounts you have paid to figma in the preceding twelve months for the services, we may terminate your access to and use of the services, at our sole discretion, at any time and without notice we may terminate your access to and use of the services, at our sole discretion, at any time and without notice you may cease use of the services at any time."
"With the exception of countries that are embargoed or designated as supporting terrorist activities by the united states government, with the exception of countries that are embargoed or designated as supporting terrorist activities by the united states government, non-refundable, non-refundable, we (or our third party payment processor) will automatically charge you in accordance with the term of your subscription (e.g., each month, quarter, or year), on the calendar day corresponding to the commencement of your subscription using the payment information you have provided. we (or our third party payment processor) will automatically charge you in accordance with the term of your subscription (e.g., each month, quarter, or year), on the calendar day corresponding to the commencement of your subscription using the payment information you have provided."
"We make no warranty that the services will meet your requirements we make no warranty that the services will meet your requirements be available on an uninterrupted, secure, or error-free basis."
"Rent, lease, distribute, sell, transfer, or otherwise permit third parties to use the services; customer will not, will ensure its authorized users do not, and will not encourage or assist third parties to: a. rent, lease, distribute, sell, transfer, or otherwise permit third parties to use the services;"
Or (iii) your violation of these terms.
"Last updated: august 19, 2021."
"Customer will not, will ensure its authorized users do not, and will not encourage or assist third parties to: a."
"If you continue to use the services after such a change, you are indicating that you agree to the modified terms."
"For example, you must be 13 years or older under united states law, or 16 years or older under european union law."
"Figma does not warrant, support, nor accept responsibility of any kind for any application(s) and/or material(s) that are developed by a party outside of figma’s organization, including design files, plugins, component libraries, and code components (“ non-figma resources ”)."
Indemnity.
"We may also change or discontinue all or any part of the services, at any time and without notice, at our sole discretion. we may also change or discontinue all or any part of the services, at any time and without notice, at our sole discretion."
These terms will be governed by the laws of the state of california without regard to its conflict of laws provisions.
"If we do so, we will let you know either by posting the modified terms on the site or through other communications."
You may cease use of the services at any time.
"Neither figma nor any other party involved in creating, producing, or delivering the services (“suppliers”) will be liable for any incidental, special, exemplary or consequential damages, including lost profits, loss of data or goodwill, service interruption, computer damage, system failure, or the cost of substitute services arising out of or in connection with these terms or from the use of or inability to use the services, whether based on warranty, contract, tort (including negligence), product liability, or any other legal theory, and whether or not figma has been informed of the possibility of such damage."
"If you don’t want to agree to arbitrate your claims as explained above, then you can opt-out of this arbitration agreement by notifying us of your decision in writing at legal@figma.com, 760 market st, floor 10, san francisco, ca 94102."
"Figma does not warrant, support, nor accept responsibility of any kind for any application(s) and/or material(s) that are developed by a party outside of figma’s organization, including design files, plugins, component libraries, and code components (“non-figma resources”)."
"We may modify the terms at any time, at our sole discretion."
(ii) your user content.
"You own all right, title, and interest in any application(s) and/or material(s) that are developed by you on the services or uploaded to the services by you."
"We make no warranty regarding the quality, we make no warranty regarding the quality, the services are provided “as is,” without warranty of any kind."
"Neither figma nor any other party involved in creating, producing, or delivering the services (“ suppliers ”) will be liable for any incidental, special, exemplary or consequential damages, including lost profits, loss of data or goodwill, service interruption, computer damage, system failure, or the cost of substitute services arising out of or in connection with these terms or from the use of or inability to use the services, whether based on warranty, contract, tort (including negligence), product liability, or any other legal theory, and whether or not figma has been informed of the possibility of such damage."
"You agree to resolve your claims with us solely on an individual basis, and not as part of a class, representative or consolidated action."
"You hereby irrevocably transfer and assign all right, title, and interest (including all intellectual property rights, such as copyrights or trade secrets) in and to the feedback, you hereby irrevocably transfer and assign all right, title, and interest (including all intellectual property rights, such as copyrights or trade secrets) in and to the feedback, the invalidity or unenforceability of any provision of these terms will not affect the validity or enforceability of any other provision hereof the invalidity or unenforceability of any provision of these terms will not affect the validity or enforceability of any other provision hereof for the avoidance of doubt, figma may engage third parties as service providers to the services for the avoidance of doubt, figma may engage third parties as service providers to the services these terms will be governed by the laws of the state of california without regard to its conflict of laws provisions."
"Be available on an uninterrupted, secure, or error-free basis."
You may only use the services if you are old enough to consent (by yourself and not by a parent or guardian) to share your data under applicable law.
