"If any part of this agreement is held invalid or unenforceable, that portion of the agreement will be construed to reflect the parties’ original intent."
"You agree to indemnify us, defend us, and hold us harmless from and against any and all claims, liabilities, and expenses, including attorneys’ fees, arising out of your use of the website and the service, including but not limited to your violation of this agreement."
"There will be no refunds for partial months or partial years of service, downgrade refunds, or refunds for months or years unused with an open team account."
"For user accounts, any other information requested, such as your real name, is optional."
"When permitted, we will make a reasonable effort to notify users of any disclosure of their information, unless we are prohibited by law or court order from doing so, or in rare, exigent circumstances."
"We will not be liable to you or any third party for any loss of profits, use, goodwill, or data, or for any incidental, indirect, special, consequential or exemplary damages, however arising, that result from the use, disclosure, or display of your user-generated content we will not be liable to you or any third party for any loss of profits, use, goodwill, or data, or for any incidental, indirect, special, consequential or exemplary damages, however arising, that result from the use, disclosure, or display of your user-generated content you agree to indemnify us, defend us, and hold us harmless from and against any and all claims, liabilities, and expenses, including attorneys’ fees, arising out of your use of the website and the service, including but not limited to your violation of this agreement."
One person or legal entity may maintain no more than one free account. one person or legal entity may maintain no more than one free account.
You are responsible for maintaining the security of your account.
You retain ownership of and responsibility for your content.
"You retain all moral rights to your content that you upload, publish, or submit to any part of the service, including the rights of integrity and attribution."
You are responsible for all content posted and activity that occurs under your account (even if the content is posted by others).
The remaining portions will remain in full force and effect.
"Observable provides the website and the service “as is” and “as available,” without warranty of any kind."
Any failure on the part of observable to enforce any provision of this agreement will not be considered a waiver of our right to enforce such provision.
You may close your account at any time.
"Governed by the federal laws of the united states of america and the laws of the state of california governed by the federal laws of the united states of america and the laws of the state of california if any part of this agreement is held invalid or unenforceable, that portion of the agreement will be construed to reflect the parties’ original intent."
"To complete signup for team accounts, a company name, your real name, and valid payment information must also be provided."
"Effective date: march 12, 2019 effective date: march 12, 2019 for user accounts, any other information requested, such as your real name, is optional."
"When a material change is made, we’ll post notice of the update on the website. >as observable grows and continues to add features, we may update these terms of service."
"Is unlawful or promotes unlawful activities is unlawful or promotes unlawful activities is or contains sexually obscene content is or contains sexually obscene content you will not under any circumstances: harass, abuse, threaten, or incite violence towards any individual or group you will not under any circumstances: harass, abuse, threaten, or incite violence towards any individual or group if we determine your bandwidth usage to be excessive in relation to other observable users, we reserve the right to suspend your account or throttle your notebook hosting until you can reduce your bandwidth consumption. if we determine your bandwidth usage to be excessive in relation to other observable users, we reserve the right to suspend your account or throttle your notebook hosting until you can reduce your bandwidth consumption."
"The service will be uninterrupted, timely, secure, or error-free the service will be uninterrupted, timely, secure, or error-free that the information provided through the service is accurate, reliable or correct that the information provided through the service is accurate, reliable or correct that any defects or errors will be corrected that any defects or errors will be corrected you assume full responsibility and risk of loss resulting from your downloading and/or use of files, information, content or other material obtained from the service. you assume full responsibility and risk of loss resulting from your downloading and/or use of files, information, content or other material obtained from the service."
You are responsible for all content posted and activity that occurs under your account (even if the content is posted by others). you are responsible for maintaining the security of your account.
Information observable collects information observable collects you retain ownership of and responsibility for your content.
">as observable grows and continues to add features, we may update these terms of service."
"However, you waive these rights and agree not to assert them against us, to enable us to reasonably exercise the rights granted in section e.4, but not otherwise."
"When a material change is made, we’ll post notice of the update on the website."
"However, you waive these rights and agree not to assert them against us, to enable us to reasonably exercise the rights granted in section e.4, but not otherwise. you retain all moral rights to your content that you upload, publish, or submit to any part of the service, including the rights of integrity and attribution."
