"Disputes will be settled on an individual basis : you and quizlet knowingly and voluntarily agree to waive your respective rights to bring or participate in a class, collective, consolidated, or representative action or arbitration ."
"Refunds: except where required by law, upgraded memberships purchased directly through quizlet are non-refundable."
"Quizlet, its suppliers and its licensors. except as otherwise expressly stated, all content posted to or available from the service is provided ""as is"", and quizlet, its suppliers and its licensors make no representations or warranties, express or implied, including but not limited to warranties of merchantability, fitness for a particular purpose, title, or non-infringement of proprietary rights."
"Except as otherwise expressly stated, all content posted to or available from the service is provided ""as is"", and quizlet, its suppliers and its licensors make no representations or warranties, express or implied, including but not limited to warranties of merchantability, fitness for a particular purpose, title, or non-infringement of proprietary rights."
"You understand and agree that you download from, or otherwise obtain content or services through, the service at your own discretion and risk, and that quizlet, its suppliers and its licensors will have no liability or responsibility for any damage to your computer system or data that results from the download such content or the use of the service."
"A waiver by either party of any term or condition of these terms of service or any breach thereof, in any one instance, will not waive such term or condition or any subsequent breach thereof."
"Disputes will be settled on an individual basis: you and quizlet knowingly and voluntarily agree to waive your respective rights to bring or participate in a class, collective, consolidated, or representative action or arbitration."
"If you create an account on the service, you are responsible for maintaining the security of your account and data, and you are fully responsible for all activities that occur under the account."
"Binding arbitration: any dispute arising out of or relating to these terms or your use of our services will be settled through binding arbitration, conducted by the american arbitration association (""aaa"") and in accordance with their commercial arbitration rules."
"You agree to defend, indemnify and hold harmless quizlet, its contractors, and its licensors, and their respective directors, officers, employees and agents from and against any and all claims and expenses, including attorneys' fees, arising from your use of the service, including but not limited to, any violation of any representation or warranty contained in these terms of service."
"Except to the extent any applicable law provides otherwise, these terms of service and any access to or use of the service will be governed by the laws of the state of california, u.s.a., excluding its conflict of law provisions, regardless of where you are located in the world. except to the extent any applicable law provides otherwise, these terms of service and any access to or use of the service will be governed by the laws of the state of california, u.s.a., excluding its conflict of law provisions, regardless of where you are located in the world."
"Refunds : except where required by law, upgraded memberships purchased directly through quizlet are non-refundable."
"Binding arbitration : any dispute arising out of or relating to these terms or your use of our services will be settled through binding arbitration, conducted by the american arbitration association ("" aaa "") and in accordance with their commercial arbitration rules."
"If any part of these terms of service is held invalid or unenforceable, that part will be construed to reflect the drafter’s original intent, and the remaining portions will remain in full force and effect."
"Quizlet, its suppliers and its licensors."
"Is patently offensive and promotes racism, bigotry, hatred or physical harm of any kind against any class or individual is patently offensive and promotes racism, bigotry, hatred or physical harm of any kind against any class or individual contains sexually suggestive, contains sexually suggestive, abusive, threatening, obscene, defamatory or libelous; abusive, threatening, obscene, defamatory or libelous; involves the transmission of junk mail, chain letters, unsolicited mass mailings or instant messages, or spam; involves the transmission of junk mail, chain letters, unsolicited mass mailings or instant messages, or spam; disclosing your password to any third party, or permitting any third party to access your account; disclosing your password to any third party, or permitting any third party to access your account; the service, including without limitation all content there available, product and membership features, any and all of quizlet’s policies, and these terms of service, may be changed at the sole discretion of quizlet without notice."
"The service, including without limitation all content there available, product and membership features, any and all of quizlet’s policies, and these terms of service, may be changed at the sole discretion of quizlet without notice."
