"To the fullest extent permitted by applicable law, if you or vercel want to assert a dispute against the other, then you or vercel must commence it (by delivery of written notice as set forth herein) within one (1) year after the dispute arises or it will be forever barred."
You shall be responsible for maintaining the confidentiality of login information associated with your account.
"The self-service subscription and any additional services added to your self-service subscription will automatically-renew for the same term as the initial term, and any domain registrations will renew on an annual basis as set forth in section 16.1 below."
"You hereby agree to indemnify and hold vercel harmless against any damages, losses, liabilities, settlements and expenses (including without limitation costs and attorneys' fees) in connection with any third party claim or action that arises from an alleged violation of the foregoing or otherwise from your use of services in a manner not authorized by this agreement."
You have the right to terminate your account at any time by sending a cancellation request to vercel support via thesupport center.
Vercel does not warrant that the services or deliverables will be uninterrupted or error free.
You certify that you are a person at least 16 years of age.
"Last update: may 6th, 2022 last update: may 6th, 2022"
"If any provision of this agreement is found to be unenforceable or invalid, that provision will be limited or eliminated to the minimum extent necessary so that this agreement will otherwise remain in full force and effect and enforceable."
"All fees are non-refundable, except as expressly stated otherwise in this agreement. all fees are non-refundable, except as expressly stated otherwise in this agreement."
"You must not access the vercel's website through automated methods, including any use of robots or other computer code which calls vercel's website. you must not access the vercel's website through automated methods, including any use of robots or other computer code which calls vercel's website."
You shall not send unsolicited messages or use the services to send unsolicited messages (also known as junk mail or spam).
Your continued use of the services after the price change becomes effective constitutes your agreement to pay the changed amount. your continued use of the services after the price change becomes effective constitutes your agreement to pay the changed amount.
"You further agree that vercel may remove or disable any of your content at any time for any reason (including, but not limited to, upon receipt of claims or allegations from third-parties or authorities relating to your content), or for no reason at all. you further agree that vercel may remove or disable any of your content at any time for any reason (including, but not limited to, upon receipt of claims or allegations from third-parties or authorities relating to your content), or for no reason at all."
