"Access without permission by software robot, software program performing multiple, automated, successive requests, or other automated or high volume electronic process, is specifically prohibited."
(4) use a hardware stealth firewall.
"(6) use security software that attempts to detect and prevent surreptitious capture and transmission of personal identifiers such as names, user-id's or numbers, e-mail addresses, unique machine specific identifiers such as your computer's permanent ethernet mac (media access control) address or cookie stored guid (globally unique identifier), or your actual ip address, (7) use high grade encryption for all private, if not all communications."
"(5) regularly use up-to-date virus checking, backup, and disk repair software."
Important!
"You are not allowed to access or use the services if you are located, incorporated or otherwise established in, or a citizen or resident of: the united states of america, u.s. state of hawaii or a jurisdiction where it would be illegal according to applicable law for you (by reason of your nationality, domicile, citizenship, residence or otherwise) to access or use the services or where the publication or availability of the services is prohibited or contrary to local law or regulation the license granted herein to use torrents or other content shall automatically terminate upon your failure to comply with the terms of this user agreement, and all monies owed shall immediately become due and payable, however all other obligations and provisions hereunder shall survive."
(8) never send confidential information or information not intended for publication using any e-mail link on this website.
"This website may be used by persons not at least eighteen (18) years of age or otherwise not legally able to agree to abide by the term and conditions of this user agreement only with the permission of both (1) their parent or legal guardian, and (2) the owner of the computer equipment being used, both of whom accept this user agreement."
(3) use a browser that withholds the referring url if you prefer this option.
"Your access or use will not impair, diminish, or dispute our intellectual property rights in this website and its content, damage our reputation, or interfere with the operation of the yts website your access or use will not impair, diminish, or dispute our intellectual property rights in this website and its content, damage our reputation, or interfere with the operation of the yts website description of any third party product, service, or activity or a link thereto does not imply any determination regarding its quality, suitability, safety, or lawfulness, which is entirely your responsibility description of any third party product, service, or activity or a link thereto does not imply any determination regarding its quality, suitability, safety, or lawfulness, which is entirely your responsibility access without permission by software robot, software program performing multiple, automated, successive requests, or other automated or high volume electronic process, is specifically prohibited."
All torrents are for private non-commercial educational viewing purposes only.
"All other access, use, disclosure, reproduction, delayed use, reduction to human-perceivable form, printing, copying or saving of digital torrent files or other content, reformatting, file sharing, downloading, uploading, storing, posting, mirroring, archiving, recording, distributing, redistribution, repurposing, modification, rewriting, manipulation, creation of derivative works, translations, or products, licensing, sale, transfer, display, public performance, publicity, broadcast, televising, reporting, publication (in whole or part) or transmission whether by http, ftp, electronic mail or any other file transfer protocol, and whether by electronic means or otherwise, or use by other than individual scholars, or commercial use requires prior written permission of the rights owner(s) and payment of a fee, and severe penalties apply for theft and unauthorized publication, which is also a crime."
"Any submissions, contributions, questions, comments, feedback, suggestions, ideas, techniques, concepts, know-how or other information received by yts.mx shall be deemed not to be confidential and may be freely used, edited, modified, adapted, translated, disseminated, published, deleted, licensed, disclosed, and/or distributed by yts.mx without limitation and without compensation, anywhere, in any manner, and for any purpose whatsoever."
"You are not allowed to access or use the services if you are located, incorporated or otherwise established in, or a citizen or resident of: the united states of america, u.s. state of hawaii or a jurisdiction where it would be illegal according to applicable law for you (by reason of your nationality, domicile, citizenship, residence or otherwise) to access or use the services or where the publication or availability of the services is prohibited or contrary to local law or regulation important!"
(9) be aware that e-mail addresses appearing on websites are subject to abuse by spammers.
"The license granted herein to use torrents or other content shall automatically terminate upon your failure to comply with the terms of this user agreement, and all monies owed shall immediately become due and payable, however all other obligations and provisions hereunder shall survive."
"Monetary gifts are also greatly appreciated, shall be unrestricted, and may be used for any purpose."
"We strongly recommend the following minimum general privacy and security measures (among others) which are not specific to this website, if and to the extent that you wish to maintain your privacy: (1) use a proxy server that hides your actual ip address so that it does not appear in server log files."
"Continued use of this website or its contents indicates and shall be deemed to constitute your affirmation of your agreement to this entire user agreement, including all such restrictions and any changes."
"If any portion of this agreement shall be held unenforceable, invalid or inoperative, then, (a) the remainder of this agreement shall be considered valid and operative, and the remaining provisions shall be nevertheless carried into effect, and (b) insofar as it is reasonable and possible, effect shall be given to the intent manifested by the portion held unenforceable, invalid or inoperative, and such portion shall be reformed only to the extent necessary to make it enforceable."
"Due to the coppa law, children under the age of 13 years are prohibited from contacting the yts site due to the coppa law, children under the age of 13 years are prohibited from contacting the yts site any submissions, contributions, questions, comments, feedback, suggestions, ideas, techniques, concepts, know-how or other information received by yts.mx shall be deemed not to be confidential and may be freely used, edited, modified, adapted, translated, disseminated, published, deleted, licensed, disclosed, and/or distributed by yts.mx without limitation and without compensation, anywhere, in any manner, and for any purpose whatsoever."
"And, extremely important, (10) block all hosts that do not conform to your expectations of proper conduct."
"(2) if you enable cookies which many websites require to operate properly (but which we do not currently and never have used, but which are used by third parties), you should erase them at least daily."
"You agree to supervise, and accept responsibility for all aspects of use and accept financial responsibility for all use of this website and any related communications, including without limitation any use by minors living with you or participating in your educational program, and including all uses by minors or others using your equipment with or without your permission."
